MAINTENANCE_AGENCY_ID,VARIABLE_ID,CODE,NAME,DOMAIN_ID,DESCRIPTION,PRIMARY_CONCEPT,IS_DECOMPOSED
ECB,AE_ITM_TYP_INSTRMNT,AE_ITM_TYP_INSTRMNT,Asset encumbrance item specifying details about the instrument,AE_ITM,Specifies if the Type of instrument is an Asset or a Collateral received.,,true
ECB,ENCMBRD_ASST_CLLTRL_RCVD,ENCMBRD_ASST_CLLTRL_RCVD,Encumbered asset or collateral received,SRC_ENCMBRNC,Identifies encumbered assets or encumbered collateral received.,,true
ECB,ACCMLTD_CHNG_NGTV_CLLTRL_OBTND_PRD,ACCMLTD_CHNG_NGTV_CLLTRL_OBTND_PRD,Accumulated negative changes for collateral obtained during the period (flow),MNTRY,Accumulated negative changes for collateral obtained during the period (flow),,true
ECB,CSH_CLLCTD_EXCHNG_SLD_CLLTRL,CSH_CLLCTD_EXCHNG_SLD_CLLTRL,Cash collected net of costs in exchange of sold collateral,MNTRY,Cash collected net of costs in exchange of sold collateral,,true
ECB,FV_INSTRMNT_RPLC_SLD_CLLTRL,FV_INSTRMNT_RPLC_SLD_CLLTRL,Fair value of financial instruments replacing collateral sold,MNTRY,Fair value of financial instruments replacing collateral sold,FV,true
ECB,INCRS_ DSCNTD_AMNT_DSCNT_RT,INCRS_ DSCNTD_AMNT_DSCNT_RT,Increase in the discounted amount and effect of any change in the discount rate,MNTRY,Increase in the discounted amount and effect of any change in the discount rate,,true
ECB,ACCNTNG_PRTFL_LNKD_ASSTS,ACCNTNG_PRTFL_LNKD_ASSTS,Accounting portfolio of the  asset linked to liability,ACCNTNG_CLSSFCTN,Accounting portfolio of the  asset linked to liability,,true
ECB,CLLTRL_MXMM_AMNT_CNSDRD,CLLTRL_MXMM_AMNT_CNSDRD,Maximum amount of the collateral that can be considered,MNTRY,Maximum amount of the collateral that can be considered,,true
ECB,UNSD_AMNT_RVRSD_DRNG_PRD,UNSD_AMNT_RVRSD_DRNG_PRD,Unused amounts reversed during the period,MNTRY,Unused amounts reversed during the period,,true
ECB,TRNSFR_AMNG_EQTY_CMPNNT,TRNSFR_AMNG_EQTY_CMPNNT,Transfers among components of Equity,MNTRY,Transfers among components of Equity,,true
ECB,ACCMLTD_CHNG_NGTV_FV_CR,ACCMLTD_CHNG_NGTV_FV_CR,Accumulated changes in fair value due to credit risk - negative,MNTRY,Accumulated changes in fair value due to credit risk - negative,,true
ECB,GRSS_CRRYNG_AMNT_CLLTRL_OBTND_PRD,GRSS_CRRYNG_AMNT_CLLTRL_OBTND_PRD,Gross carrying amount of Collateral obtained during the period (flow),MNTRY,Gross carrying amount of Collateral obtained during the period (flow),GRSS_CRRYNG_AMNT,true
ECB,CHNG_ALLWNC_MDFCTN_WTHT_DRCGNT,CHNG_ALLWNC_MDFCTN_WTHT_DRCGNT,Changes in allowances due to modifications without derecognition,MNTRY,Changes in allowances due to modifications without derecognition,,true
ECB,CHNG_ALLWNC_CHNG_CR,CHNG_ALLWNC_CHNG_CR,Changes in allowances due to change in credit risk (net),MNTRY,Changes in allowances due to change in credit risk (net),,true
ECB,AMNT_WRTTN_OFF_STTMNT_PRFT_LSS,AMNT_WRTTN_OFF_STTMNT_PRFT_LSS,Amounts written-off directly to the statement of profit or loss,MNTRY,Amounts written-off directly to the statement of profit or loss,,true
ECB,RCVR_TO_STTMNT_PRFT_LSS,RCVR_TO_STTMNT_PRFT_LSS,Recoveries recorded directly to the statement of profit or loss,MNTRY,Recoveries recorded directly to the statement of profit or loss,,true
ECB,INCRS_ALLWNC_DRCGNTN,INCRS_ALLWNC_DRCGNTN,Decreases in allowances due to derecognition,MNTRY,Decreases in allowances due to derecognition,,true
ECB,OTHR_ALLWNC_ADJSTMNT,OTHR_ALLWNC_ADJSTMNT,Other adjustments in allowances,MNTRY,Other adjustments in allowances,,true
ECB,GN_LSS_DRCGNTN,GN_LSS_DRCGNTN,Gains and losses on derecognition,MNTRY,Gains and losses on derecognition,,true
ECB,CHNG_ALLWNC_UPDT_MTHD_ESTMTN,CHNG_ALLWNC_UPDT_MTHD_ESTMTN,Changes in allowances due to update in methodology for estimation (net),MNTRY,Changes in allowances due to update in methodology for estimation (net),,true
ECB,DCRS_ALLWNC_WRT_OFF,DCRS_ALLWNC_WRT_OFF,Decrease in allowances due to write-offs,MNTRY,Decrease in allowances due to write-offs,,true
ECB,INCRS_ALLWNC,INCRS_ALLWNC,Increases in allowances,MNTRY,Increases in allowances,,true
ECB,TRNSFRD_TO_PRFT_LSS,TRNSFRD_TO_PRFT_LSS,Transferred to profit or loss,MNTRY,Transferred to profit or loss,,true
ECB,CRRYNG_AMNT_CLLTRL_OBTND_PRD,CRRYNG_AMNT_CLLTRL_OBTND_PRD,Carrying amount of Collateral obtained during the period,MNTRY,Carrying amount of Collateral obtained during the period,,true
ECB,TYP_CLLTRL_GRNT_GVN,TYP_CLLTRL_GRNT_GVN,Type of collateral or guarantee given,TYP_PRTCTN,Type of collateral or guarantee given,,true
ECB,CRRNT_PRD,CRRNT_PRD,Current period (flow),MNTRY,Economic flow in the balance sheet statement of profit and loss,,true
ECB,HLDNG_ENTTY_CD,HLDNG_ENTTY_CD,Holding company code,STRNG,Holding company code,ENTTY_CD,true
ECB,TYP_DFND_BNFT_PLN_ASSTS,TYP_DFND_BNFT_PLN_ASSTS,Type of defined benefit plan assets,TYP_INSTRMNT,Type of defined benefit plan assets,,true
ECB,INSTRMNT_NMBR,INSTRMNT_NMBR,Number of instruments,INTGR,Number of instruments,,true
ECB,PSTN_INSTRMNT,PSTN_INSTRMNT,Position of the instrument,PSTN_INSTRMNT,"For instruments in which the reporting institution can hold different postions, this variable serves to identify that position.",,true
ECB,AMNT_USD,AMNT_USD,Amounts used,MNTRY,Amounts used,,true
ECB,IMPRMNT_LSS_RVRSL,IMPRMNT_LSS_RVRSL,Impairment loss reversals,MNTRY,Impairment loss reversals,,true
ECB,SHRT_PSTN_INDCTR,SHRT_PSTN_INDCTR,Short position indicator,SHRT_PSTN_INDCTR,A variable identifying the obligation to deliver a security by an entity that sells the security it has borrowed and does not yet own.,,true
ECB,TTL_CMPRHNSV_INCM,TTL_CMPRHNSV_INCM,Total comprehensive income,MNTRY,Total comprehensive income,,true
ECB,CRRYNG_AMNT_CLLTRL_OBTND,CRRYNG_AMNT_CLLTRL_OBTND,Carrying amount of Collateral obtained,MNTRY,Carrying amount of Collateral obtained,CRRYNG_AMNT,true
ECB,HLD_MTRTY_INDCTR,HLD_MTRTY_INDCTR,Held to maturity indicator,HLD_MTRTY_INDCTR,A variable indicating whether the investments is intended for investments in debt instruments that the entity will not sell before their maturity date irrespective of changes in market prices or the entity’s financial position or performance. ,,true
ECB,EQTY_FRM_SHR_BSD_PYMNT_CHNG,EQTY_FRM_SHR_BSD_PYMNT_CHNG,Changes in Equity from share based payments,MNTRY,Changes in Equity from share based payments,,true
ECB,ACCMLTD_IMPRMN_NGTV_CHNG_FV_CR,ACCMLTD_IMPRMN_NGTV_CHNG_FV_CR,"Accumulated impairment, accumulated changes in fair value due to credit risk - negative",MNTRY,"Accumulated impairment, accumulated changes in fair value due to credit risk - negative",,true
ECB,IMPRMNT_LSS_ADDTN,IMPRMNT_LSS_ADDTN,Impairment loss additions,MNTRY,Impairment loss additions,,true
ECB,WGHTD_AVRG_TM_PST_DU,WGHTD_AVRG_TM_PST_DU,Weighted average of time past due,RL,Weighted average of time past due,TM_PST_DU,true
ECB,HLD_TRDNG_INDCTR,HLD_TRDNG_INDCTR,Held for trading indicator,HLD_TRDNG_INDCTR,A variable indicating whether the financial instrument or portfolio is classified as held for trading,,true
ECB,STFF_NMBR,STFF_NMBR,Number of staff,INTGR,Number of staff,,true
ECB,TRNSFR_BTWN_ALLWNC,TRNSFR_BTWN_ALLWNC,Transfers between allowances,MNTRY,Transfers between allowances,,true
ECB,ISSNC_PRFRNC_SHRS,ISSNC_PRFRNC_SHRS,Issuance of preference shares (flow),MNTRY,Issuance of preference shares (flow),,true
ECB,ADJSTMNT_CRRYNG_AMNT,ADJSTMNT_CRRYNG_AMNT,Adjustments to carrying amount,MNTRY,Adjustments to carrying amount,,true
ECB,FRGN_CRRNCY_TRNSLTN,FRGN_CRRNCY_TRNSLTN,Foreign currency translation,MNTRY,Foreign currency translation,,true
ECB,VLTN_DT,VLTN_DT,Valuation date,DT_OPNNG_BLNC,Date at which a certain valuation occurs,,true
ECB,OTHR_DFND_BNFT_OBLGTN_CHNG,OTHR_DFND_BNFT_OBLGTN_CHNG,Other change in Defined benefit obligations,MNTRY,"Change in Defined benefit obligations other than Current and past service cost, Defined benefit obligations interest cost, Contributions paid by plan participants, Actuarial gains and losses, Foreign currency translation, Defined benefit obligations paid,",,true
ECB,TRSRY_SHR_SL_CNCLLTN,TRSRY_SHR_SL_CNCLLTN,Sale/Cancellation of Treasury Shares,MNTRY,Sale/Cancellation of Treasury Shares,,true
ECB,DCRS_IA_ANCFV_CR,DCRS_IA_ANCFV_CR,"Decrease in impairment allowances, accumulated negative changes in fair value due to credit risk",MNTRY,"Decrease in impairment allowances, accumulated negative changes in fair value due to credit risk",ACCMLTD_IMPRMN_NGTV_CHNG_FV_CR,true
ECB,HLDNG_ENTTY_NM,HLDNG_ENTTY_NM,Name of Holding entity,STRNG,Name of Holding entity,,true
ECB,VLTN_GN_LSS_TKN_TO_EQTY,VLTN_GN_LSS_TKN_TO_EQTY,Valuation gains and losses taken to equity,MNTRY,Valuation gains and losses taken to equity,,true
ECB,BSNSS_CMBNTN_DVSTTR,BSNSS_CMBNTN_DVSTTR,Business combinations or divestitures,MNTRY,Business combinations or divestitures,,true
ECB,EFFCT_ERRR_CRRCTN,EFFCT_ERRR_CRRCTN,Effects of corrections of errors,MNTRY,Effects of corrections of errors,,true
ECB,GRNT_MXMM_AMNT_CNSDRD,GRNT_MXMM_AMNT_CNSDRD,Maximum amount of the guarantee that can be considered,MNTRY,Maximum amount of the guarantee that can be considered,,true
ECB,PRCHS_TRSRY_SHRS,PRCHS_TRSRY_SHRS,Purchase of Treasury Shares,MNTRY,Purchase of Treasury Shares,,true
ECB,GRSS_CRRYNG_AMNT_CLLTRL_OBTND,GRSS_CRRYNG_AMNT_CLLTRL_OBTND,Gross carrying amount of collateral obtained,MNTRY,Gross carrying amount of collateral obtained,GRSS_CRRYNG_AMNT,true
ECB,CRRNT_SRVC_CST,CRRNT_SRVC_CST,Current service cost (flow),MNTRY,Current service cost (flow),,true
ECB,CLLTRL_OBTND_TKNG_PSSSSN_NMBR,CLLTRL_OBTND_TKNG_PSSSSN_NMBR,Number of collaterals obtained by taking possession,INTGR,Number of collaterals obtained by taking possession,,true
ECB,ACCMLTD_NGTV_VL_ADJSTMNT_CR,ACCMLTD_NGTV_VL_ADJSTMNT_CR,Accumulated negative value adjustments. Credit risk induced,MNTRY,Accumulated negative value adjustments. Credit risk induced,,true
ECB,TYP_INSTRMNT_LNKD_ASSTS,TYP_INSTRMNT_LNKD_ASSTS,Type of instrument of asset linked to liability,TYP_INSTRMNT,Type of instrument of asset linked to liability,,true
ECB,EXCRS_EXPRTN_EQTY_OTHR_CPTL,EXCRS_EXPRTN_EQTY_OTHR_CPTL,Exercise/Expiration of equity Instruments other than capital Instruments,MNTRY,Exercise/Expiration of equity Instruments other than capital Instruments,,true
ECB,PRSNT_VL,PRSNT_VL,Present value,MNTRY,Present value,,true
ECB,STFF_TYP,STFF_TYP,Type of staff,STFF_TYP,Indicates the type of staff,,true
ECB,TYP_ACCNTNG_ITM_LNKD_ASSTS,TYP_ACCNTNG_ITM_LNKD_ASSTS,Type of accounting item of asset linked to liability,TYP_ACCNTNG_ITM,Type of accounting item of asset linked to liability,,true
ECB,RCLSSFCTN_INSTRMNT_EQTY_LBLTY,RCLSSFCTN_INSTRMNT_EQTY_LBLTY,Reclassification of financial instruments from equity to liability,MNTRY,Reclassification of financial instruments from equity to liability,,true
ECB,TYP_INSTRMNT_GNRTS_ACCNTNG_ITM,TYP_INSTRMNT_GNRTS_ACCNTNG_ITM,Type of instrument generating accounting item,TYP_INSTRMNT,Type of instrument generating accounting item,,true
ECB,ADDTNS_INCLDNG_EXSTNG_PRVSNS,ADDTNS_INCLDNG_EXSTNG_PRVSNS,"Additions, including increases in existing provisions",MNTRY,"Additions, including increases in existing provisions",,true
ECB,RLTD_PRTS_RLTNSHPS,RLTD_PRTS_RLTNSHPS,Related parties/Relationships,RLTNSHP,Related parties/Relationships,,true
ECB,INCRS_IA_ANCFV_CR,INCRS_IA_ANCFV_CR,"Increase in impairment allowances, accumulated negative changes in fair value due to credit risk",MNTRY,"Increase in impairment allowances, accumulated negative changes in fair value due to credit risk",ACCMLTD_IMPRMN_NGTV_CHNG_FV_CR,true
ECB,DCRS_IA_ANCFV_CR_ACCRD_UNWNDNG,DCRS_IA_ANCFV_CR_ACCRD_UNWNDNG,"Decrease in impairment allowances, accumulated negative changes in fair value due to credit risk.Unwinding effect (accounting)",MNTRY,"Decrease in impairment allowances, accumulated negative changes in fair value due to credit risk.Unwinding effect (accounting)",ACCMLTD_IMPRMN_NGTV_CHNG_FV_CR,true
ECB,INCRS_IA_ANCFV_CR_ACCRD_INTRST,INCRS_IA_ANCFV_CR_ACCRD_INTRST,"Increase in impairment allowances, accumulated negative changes in fair value due to credit risk.On interest accrued",MNTRY,"Increase in impairment allowances, accumulated negative changes in fair value due to credit risk.On interest accrued",ACCMLTD_IMPRMN_NGTV_CHNG_FV_CR,true
ECB,DCRS_IA_ANCFV_CR_ACCRD_RVRSL,DCRS_IA_ANCFV_CR_ACCRD_RVRSL,"Decrease in impairment allowances, accumulated negative changes in fair value due to credit risk.Reversals",MNTRY,"Decrease in impairment allowances, accumulated negative changes in fair value due to credit risk.Reversals",ACCMLTD_IMPRMN_NGTV_CHNG_FV_CR,true
ECB,TYP_ENTTY_CD_INVST,TYP_ENTTY_CD_INVST,Type of entity code of the investee,TYP_ID,The type of code used to uniquely identify the investee,TYP_ENTTY_CD,true
ECB,ACCMLTD_CHNG_NGTV_CLLTRL_OBTND,ACCMLTD_CHNG_NGTV_CLLTRL_OBTND,Accumulated negative changes for collateral obtained,MNTRY,Accumulated negative changes for collateral obtained,,true
ECB,WRTFFS_DRNG_PRD,WRTFFS_DRNG_PRD,Write-offs during the period,MNTRY,Write-offs during the period,,true
ECB,EFFCT_ASST_CLNG_AMNT,EFFCT_ASST_CLNG_AMNT,Effect of the asset ceiling,MNTRY,Effect of the asset ceiling,,true
ECB,ACTRL_GN_LSS_CHG_FNNCL_ASSMPTN,ACTRL_GN_LSS_CHG_FNNCL_ASSMPTN,Actuarial gains or losses from changes in financial assumptions,MNTRY,Actuarial gains or losses from changes in financial assumptions,,true
ECB,EXPNS_TYP,EXPNS_TYP,Type of expense,EXPNS_TYP,Indicates the type of staff or other than staff expenses.,,true
ECB,RCLSSFCTN_INSTRMNT_LBLTY_EQTY,RCLSSFCTN_INSTRMNT_LBLTY_EQTY,Reclassification of financial instruments from liability to equity,MNTRY,Reclassification of financial instruments from liability to equity,,true
ECB,PSTV_FV,PSTV_FV,Positive fair value,MNTRY,Positive fair value,,true
ECB,NGTV_FV,NGTV_FV,Negative fair value,MNTRY,Negative fair value,,true
ECB,ASST_INVLVD_INSTTN_SRVC_PRVDD,ASST_INVLVD_INSTTN_SRVC_PRVDD,Amount of Assets involved in the services provided by the institution,MNTRY,Amount of Assets involved in the services provided by the institution,,true
ECB,NMNL_VL_MX_CLLTRL_GRNT_CNSDRD,NMNL_VL_MX_CLLTRL_GRNT_CNSDRD,"Nominal amount, Maximum collateral/guarantee that can be considered",MNTRY,"Nominal amount, Maximum collateral/guarantee that can be considered",,true
ECB,AVRG_DRTN_LTGTN_DRNG_PRD,AVRG_DRTN_LTGTN_DRNG_PRD,Average duration of litigation procedures concluded during the period,RL,Average duration of litigation procedures concluded during the period,,true
ECB,GRP_STRCTR_RLTNSHP,GRP_STRCTR_RLTNSHP,Group structure relationship,RLTNSHP,"The relationship between the ultimate parent and the investee (parent or entity with joint control of the reporting institution, subsidiary, joint venture or associate) FinRep Annex V 296.",,true
ECB,HLDNG_CMPNY_LEI,HLDNG_CMPNY_LEI,Holding company LEI code,STRNG,Holding company LEI code,,true
ECB,CLLTRL_MXMM_AMNT_GRNT_CNSDRD,CLLTRL_MXMM_AMNT_GRNT_CNSDRD,Maximum amount of the collateral/guarantee that can be considered,MNTRY,"For banks this piece of information is a result of the allocation of collateral and guarantees on the instruments according to FinREP criteria. It is the maximum amount of the collateral or guarantee that can be considered as credit protection for the instruments. The sum of the amounts of the financial guarantee and/or collateral for a specific instrument shall not exceed the carrying amount or the nominal amount of the instrument. For instruments that have simultaneously more than one type of collateral or guarantee, the amount of the Maximum amount of the collateral/guarantee that can be considered shall be allocated according to its quality starting from the one with the best quality. For instruments collateralised by immovable property, immovable property collateral shall always be reported first, irrespective of its quality compared to other collateral. Where the Maximum amount of the collateral/guarantee that can be considered exceeds the value of immovable property collateral, its remaining value shall be allocated to other collateral types and guarantees according to its quality starting from the one with best quality",,true
ECB,OTHR_RCLSSFCTN_HDG_FRGN_OPRTN,OTHR_RCLSSFCTN_HDG_FRGN_OPRTN,"Reclassifications other than valuation gains and losses taken to equity, Transferred to profit or loss",MNTRY,"Reclassifications other than valuation gains and losses taken to equity, Transferred to profit or loss",,true
ECB,ESTMTD_LSS_PRD_DCRSS_ALLWNC,ESTMTD_LSS_PRD_DCRSS_ALLWNC,Decreases in allowances due to amounts reversed for estimated loan losses during the period,MNTRY,Decreases in allowances due to amounts reversed for estimated loan losses during the period,,true
ECB,TYP_PRDNTL_CNSLDTN,TYP_PRDNTL_CNSLDTN,Type of prudential consolidation,CNSLDTN_MTHD,Methods for prudential consolidation as defined by art.18 of Regulation (EU) No 575/2013.,,true
ECB,TRNSFRRD_INTL_CRRYNG_AMNT_HDGD,TRNSFRRD_INTL_CRRYNG_AMNT_HDGD,Transferred to initial carrying amount of hedged items,MNTRY,Transferred to initial carrying amount of hedged items,,true
ECB,OTHR_RCLSSFCTN_CSH_FLW_HDG,OTHR_RCLSSFCTN_CSH_FLW_HDG,"Reclassifications other than valuation gains and losses taken to equity, Transferred to profit or loss, Transferred to initial carrying amount of hedged items",MNTRY,"Reclassifications other than valuation gains and losses taken to equity, Transferred to profit or loss, Transferred to initial carrying amount of hedged items",,true
ECB,OFF_BLNC_SHT_ACCNTNG_CLSSFCTN,OFF_BLNC_SHT_ACCNTNG_CLSSFCTN,Off-balance sheet items accounting classification,ACCNTNG_CLSSFCTN,"Where loan commitments, financial guarantees and other commitments given are measured at fair value through profit or loss, any change in the fair value, including changes due to credit risk, shall be reported as ‘other financial liabilities’ and not as provisions for ‘Commitments and guarantees given’ (as defined in Annex V, part 2.40)",,true
ECB,GCA_EXPSR_DRCGNSD_LTGTN,GCA_EXPSR_DRCGNSD_LTGTN,Gross carrying amount of exposures  derecognised due to litigation procedures concluded during the period,MNTRY,Gross carrying amount of exposures  derecognised due to litigation procedures concluded during the period,GRSS_CRRYNG_AMNT,true
ECB,ECNMC_ACTVTY_INVST,ECNMC_ACTVTY_INVST,Economic activity of the investee,ECNMC_ACTVTY,Economic activity of the investee,,true
ECB,OTHR_CHNG_PRVSN,OTHR_CHNG_PRVSN,Other changes in Provisions,MNTRY,"Changes in Provisions other than Additions, including increases in existing provisions, Amounts used, Unused amounts reversed during the period, Increase in the discounted amount and effect of any change in the discount rate",,true
ECB,GDWLL_INCLDD_CRRYNG_AMNT,GDWLL_INCLDD_CRRYNG_AMNT,Goodwill included in carrying amount,MNTRY,Goodwill included in carrying amount,,true
ECB,TYP_ACCNTNG_CNSLDTN,TYP_ACCNTNG_CNSLDTN,Type of accounting consolidation,CNSLDTN_MTHD,Type of accounting consolidation,,true
ECB,DT_OPNNG_BLNC,DT_OPNNG_BLNC,Reference date opening balance,DT_OPNNG_BLNC,Reference date opening balance,,true
ECB,ISSNC_EQTY_OTHR_CPTL_INSTRMNT,ISSNC_EQTY_OTHR_CPTL_INSTRMNT,Issuance of equity Instruments other than capital instruments (flow),MNTRY,Issuance of equity Instruments other than capital instruments (flow),,true
ECB,NT_CMLTD_RCVRS_LTGTN_DRNG_PRD,NT_CMLTD_RCVRS_LTGTN_DRNG_PRD,Net cumulated recoveries from litigation procedures concluded during the period,MNTRY,Net cumulated recoveries from litigation procedures concluded during the period,,true
ECB,FLW_RSN,FLW_RSN,Reason/source of the flow,FLW_RSN,Reason/source of the flow,,true
ECB,AI_ANCFV_CR_EXPSR_DRCGNSD_CLLTRL,AI_ANCFV_CR_EXPSR_DRCGNSD_CLLTRL,"Accumulated impairment, accumulated negative changes in fair value due to credit risk for exposures  derecognised in exchange for collateral obtained by taking possession",MNTRY,"Accumulated impairment, accumulated negative changes in fair value due to credit risk for exposures  derecognised in exchange for collateral obtained by taking possession",,true
ECB,EQTY_FRM_BSNSS_CMBNTN_CHNG,EQTY_FRM_BSNSS_CMBNTN_CHNG,Changes in Equity from business combinations,MNTRY,Changes in Equity from business combinations,,true
ECB,ISSNC_ORDNRY_SHRS,ISSNC_ORDNRY_SHRS,Issuance of ordinary shares (flow),MNTRY,Issuance of ordinary shares (flow),,true
ECB,OTHR_CHNG_EQTY,OTHR_CHNG_EQTY,Changes in equity other than those explicitly reported,MNTRY,Changes in equity other than those explicitly reported,,true
ECB,CRRYNG_AMNT_BFR_RSTTMNT,CRRYNG_AMNT_BFR_RSTTMNT,Carrying amount [before restatement],MNTRY,Carrying amount [before restatement],,true
ECB,EFFCT_ACCNTNG_PLCY_CHNG,EFFCT_ACCNTNG_PLCY_CHNG,Effects of changes in accounting policies,MNTRY,Effects of changes in accounting policies,,true
ECB,CPTL_RDCTN,CPTL_RDCTN,Capital Reduction,MNTRY,Capital Reduction,,true
ECB,CNVRSN_DBT_EQTY,CNVRSN_DBT_EQTY,Conversion of debt to equity,MNTRY,Conversion of debt to equity,,true
ECB,TYP_HDGD_INSTRMNT,TYP_HDGD_INSTRMNT,Type of  Hedged instrument,TYP_INSTRMNT,Type of  Hedged instrument,,true
ECB,INTL_RCGNTN_DT,INTL_RCGNTN_DT,Date / period of initial recognition,DT_OPNNG_BLNC,Date / period of initial recognition,,true
ECB,INCRS_ALLWNC_ESTMTD_LSS,INCRS_ALLWNC_ESTMTD_LSS,Increases in allowances due to amounts set aside for estimated loan losses during the period,MNTRY,Increases in allowances due to amounts set aside for estimated loan losses during the period,,true
ECB,BNFT_PD,BNFT_PD,Defined benefit obligations paid,MNTRY,Defined benefit obligations paid,,true
ECB,DFND_BNFT_OBLGTNS_INTRST_CST,DFND_BNFT_OBLGTNS_INTRST_CST,Defined benefit obligations interest cost,MNTRY,Defined benefit obligations interest cost,,true
ECB,CNTRBTN_PD_PLN_PRTCPNT,CNTRBTN_PD_PLN_PRTCPNT,Contributions paid by plan participants,MNTRY,Contributions paid by plan participants,,true
ECB,PST_SRVC_CST,PST_SRVC_CST,Past service cost,MNTRY,Past service cost,,true
ECB,ACTRL_GN_LSS_CHG_DMGRPHC,ACTRL_GN_LSS_CHG_DMGRPHC,Actuarial gains or losses from changes in demographic assumptions,MNTRY,Actuarial gains or losses from changes in demographic assumptions,,true
ECB,TYP_RSK_TRNSFR,TYP_RSK_TRNSFR,Type of risk transfer,TYP_TRNSFR,It defines the type of risk transfer.,,true
ECB,VL_ADJSTMNT_RCRDD_INCM_STTMNT,VL_ADJSTMNT_RCRDD_INCM_STTMNT,Value adjustments recorded directly to the income statement,MNTRY,Value adjustments recorded directly to the income statement,,true
ECB,TYP_ACTVTY,TYP_ACTVTY,Type of activity,TYP_ACTVTY,Type of activity,,true
ECB,HDG_INSTRMNT,HDG_INSTRMNT,Hedged or hedging instrument,HDG_INSTRMNT,The variable defines if an instrument is hedged or is an hedging instrument,,true
ECB,TYP_HDGNG_INSTRMNT,TYP_HDGNG_INSTRMNT,Type of  Hedging instrument,TYP_INSTRMNT,Type of  Hedging instrument,,true
ECB,ITM_GNRTS_ACCNTNG_ITM,ITM_GNRTS_ACCNTNG_ITM,Type of accounting item generating accounting item,TYP_ACCNTNG_ITM,Type of accounting item generating accounting item,,true
ECB,TYP_ACTVTY_RLTD_PRTS,TYP_ACTVTY_RLTD_PRTS,Type of activity of Related parties/Relationships,TYP_ACTVTY,Type of activity of Related parties/Relationships,,true
ECB,AMNT_CSH_EQVLNT_CLLCTD_NT_CSTS,AMNT_CSH_EQVLNT_CLLCTD_NT_CSTS,Amount of cash or cash equivalents collected net of costs,MNTRY,Amount of cash or cash equivalents collected net of costs,,true
ECB,WRTFFS_DRNG_PRD_DBT_FRGVNSS,WRTFFS_DRNG_PRD_DBT_FRGVNSS,Write-offs during the period.Debt forgiveness,MNTRY,Write-offs during the period.Debt forgiveness,,true
ECB,RCLSSFD_PRFT_LSS_INDCTR,RCLSSFD_PRFT_LSS_INDCTR,To be reclassified to profit or loss,RCLSSFD_PRFT_LSS_INDCTR,To be reclassified to profit or loss,,true
ECB,CNSLDTN_SCP,CNSLDTN_SCP,Scope of consolidation,CNSLDTN_SCP,"It defines the reason of consolidation of an entity in a group (prudential, acounting)",,true
ECB,ACCNTNG_PRTFL_VLTN_RL,ACCNTNG_PRTFL_VLTN_RL,Accounting portfolio valuation rules,VLTN_RL,Valuation rules used for aggregating financial instruments in accounting portfolios,,true
ECB,TYP_ENTTY_CD_HLDNG,TYP_ENTTY_CD_HLDNG,Type of entity code of the holding company,TYP_ID,The type of code used to uniquely identify the holding company,TYP_ENTTY_CD,true
ECB,IS_OWNR,IS_OWNR,Is owner of,BLN,"This attribute provides a link between entities based on the concept of 'capital share'. The Cube can be used to link a subsidiary with the parent undertaking, setting the control flag as 'true'. Parent undertaking as the same meaning as defined in Article 4(1)(15)(a) of Regulation EU No 575/2013.",,true
ECB,FLW_DRCTN,FLW_DRCTN,Flow direction,FLW_DRCTN,Flow direction,,true
ECB,TYP_CLLTRL_GRNT_RCVD,TYP_CLLTRL_GRNT_RCVD,Type of collateral or guarantee received,TYP_PRTCTN,Type of collateral or guarantee received,,true
ECB,TM_PST_DU,TM_PST_DU,Time past due,TM_INTRVL,Time past due,,true
ECB,IS_DMSTC_ACTVTY,IS_DMSTC_ACTVTY,Is domestic activity,BLN,"Institutional unit resident in the same country as the legal entity to which it belongs to. IF country = country(head office) THEN TRUE,
ELSE FALSE",,true
ECB,TYP_PRDNTL_ITM,TYP_PRDNTL_ITM,Type of prudential item,TYP_PRDNTL_ITM,(insert description please),,true
ECB,MTRCS,MTRCS,Variable for metrics,STRNG,A repository for metrics variables,,true
ECB,SUBA_CD,SUBA_CD,SUBA Reporting Identifier,STRNG,Entity identifier used for entities without LEI (ECB SUBA),ENTTY_CD,true
ECB,ENTTY_CD,ENTTY_CD,Entity code,STRNG,Identifier code of an entity,ID,true
ECB,LVL_RPRTNG,LVL_RPRTNG,Level of reporting requested in the specific row of template,LVL_RPRTNG,Level of reporting requested in the specific row of template,,true
ECB,VALUE_STRING,VALUE_STRING,Value String,STRNG,Value String,,true
ECB,VALUE_DECIMAL,VALUE_DECIMAL,Value Decimal,MNTRY,Value Decimal,,true
ECB,TYP_ACCNTNG_ITM_INVST,TYP_ACCNTNG_ITM_INVST,Type of accounting item of investee,TYP_ACCNTNG_ITM,Type of accounting item of investee,,true
ECB,PD,PD,Probability of default,RL,"The counterparty’s probability of default over one year determined in accordance with Articles 160, 163, 179 and 180 of Regulation (EU) No 575/2013.",,
