MAINTENANCE_AGENCY_ID,VARIABLE_ID,CODE,NAME,DOMAIN_ID,DESCRIPTION,PRIMARY_CONCEPT,IS_DECOMPOSED
ECB,TX_LBLTY_RPRTNG_AGNT_ID,TX_LBLTY_RPRTNG_AGNT_ID,Tax liability Reporting agent identifier,STRNG,Identifier of the reporting agent.,TX_LBLTY_RPRTNG_AGNT_ID,
ECB,TX_LBLTY_TYP,TX_LBLTY_TYP,Tax liability type,TYP_ACCNTNG_ITM,A discriminator to distinguish between current and deferred tax liabilities.,TX_LBLTY_TYP,
ECB,TYP_ASST_PRVDD_SCRTY,TYP_ASST_PRVDD_SCRTY,Type of asset provided as security,TYP_ASST_SCRTSTN,"Specifies the type of asset backed security or covered bond, e.g. mortgage backed securities.",TYP_ASST_PRVDD_SCRTY,
ECB,TYP_CLLTRL,TYP_CLLTRL,Type of collateral,TYP_PRTCTN,,TYP_CLLTRL,
ECB,TYP_CMMTMNT,TYP_CMMTMNT,Type of commitment,TYP_CMMTMNT,Type of commitment.,TYP_CMMTMNT,
ECB,TYP_CRDT_FCLTY,TYP_CRDT_FCLTY,Type of credit facility,TYP_CMMTMNT,Classification of the credit facility.,TYP_CRDT_FCLTY,
ECB,TYP_ECNMY,TYP_ECNMY,Type of economy,ECNMY,The economy to which the organisation relates (e.g. advanced or emerging economy),TYP_ECNMY,
ECB,TYP_GRP,TYP_GRP,Type of group,GRP_TYP,,TYP_GRP,
ECB,TYP_LNG_SCRTY_PSTN_PRDNTL_PRTFL_ASSGNMNT_ACCNTNG_CLSSFCTN_FNNCL_ASSTS_ASSGNMNT,TYP_LNG_SCRTY_PSTN_PRDNTL_PRTFL_ASSGNMNT_ACCNTNG_CLSSFCTN_FNNCL_ASSTS_ASSGNMNT,Type of long security position,LNG_SCRTY_PSTN_PRDNTL_PRTFL_ASSGNMNT_ACCNTNG_CLSSFCTN_FNNCL_ASSTS_ASSGNMNT_TYP,,TYP_LNG_SCRTY_PSTN_PRDNTL_PRTFL_ASSGNMNT_ACCNTNG_CLSSFCTN_FNNCL_ASSTS_ASSGNMNT,
ECB,TYP_MSTR_AGRMNT,TYP_MSTR_AGRMNT,Type of master agreement,MSTR_AGRMNT_TYP,,TYP_MSTR_AGRMNT,
ECB,TYP_MSTR_AGRMNT_ENTTY_RL_ASSGNMNT,TYP_MSTR_AGRMNT_ENTTY_RL_ASSGNMNT,Type of master agreement entity role assigned,MSTR_AGRMNT_ENTTY_RL_ASSGNMNT_TYP,,TYP_MSTR_AGRMNT_ENTTY_RL_ASSGNMNT,
ECB,TYP_NN_FNNCL_ASST,TYP_NN_FNNCL_ASST,Type of non-financial asset,TYP_ACCNTNG_ITM,"Allows the distinction between Current tax assets, Deferred tax assets and Other assets.",TYP_NN_FNNCL_ASST,
ECB,TYP_NN_FNNCL_LBLTY,TYP_NN_FNNCL_LBLTY,Type of non financial liabilty,TYP_ACCNTNG_ITM,,TYP_NN_FNNCL_LBLTY,
ECB,TYP_PRDCT,TYP_PRDCT,Type of product,TYP_PRDCT,Type of product,TYP_PRDCT,
ECB,TYP_PRTCTN_VL_APPRCH,TYP_PRTCTN_VL_APPRCH,Type of protection valuation approach for notional amount,PRTCTN_VLTN_APPRCH,Type of protection valuation approach.,TYP_PRTCTN_VL_APPRCH,
ECB,TYP_PRTY,TYP_PRTY,Type of Party,PRTY_TYP,,TYP_PRTY,
ECB,TYP_RTNG_GRD,TYP_RTNG_GRD,Type of rating grade,RTNG_GRD_TYP,,TYP_RTNG_GRD,
ECB,TYP_RTNG_SYSTM,TYP_RTNG_SYSTM,Type of rating system,RTNG_SYSTM_TYP,,TYP_RTNG_SYSTM,
ECB,TYP_SCRTY_EXCHNG_TRDBL_DRVTV,TYP_SCRTY_EXCHNG_TRDBL_DRVTV,Type of security exchange tradedable derivative,SCRTY_EXCHNG_TRDBL_DRVTV_TYP,,TYP_SCRTY_EXCHNG_TRDBL_DRVTV,
ECB,TYP_SCRTY_PSTN,TYP_SCRTY_PSTN,Type of security position,SCRTY_EXCHNG_TRDBL_DRVTV_PSTN_TYP,,TYP_SCRTY_PSTN,
ECB,TYP_SCTRY_BRRWNG_LNDNG_TRNSCTN_INCLDNG_CSH_CLLTRL,TYP_SCTRY_BRRWNG_LNDNG_TRNSCTN_INCLDNG_CSH_CLLTRL,Type of security borrowing lending transcription,SCTRY_BRRWNG_LNDNG_TRNSCTN_INCLDNG_CSH_CLLTRL_TYP,,TYP_SCTRY_BRRWNG_LNDNG_TRNSCTN_INCLDNG_CSH_CLLTRL,
ECB,TYP_SNTHTC_SCRTSTN,TYP_SNTHTC_SCRTSTN,Type of synthetic securitisation,SCRTSN_OTHR_CRDT_TRNSFR_TYP,,TYP_SNTHTC_SCRTSTN,
ECB,ULTMT_PRNT_UNDRT_PRTY_ID,ULTMT_PRNT_UNDRT_PRTY_ID,Ultimate parent undertaking Party identifier,STRNG,"The party identifier of the ultimate parent undertaking accoring to Regulation (EU) 867/2016, defined as the ""Counterparty identifier for the legal entity which is the ultimate parent undertaking of the counterparty. This ultimate parent undertaking has no parent undertaking. If the counterparty has no parent undertaking, the counterparty identifier for the counterparty itself is to be reported. Parent undertaking has the same meaning as defined in Article 4(1)(15)(a) of Regulation (EU) No 575/2013."".",ULTMT_PRNT_UNDRT_PRTY_ID,
ECB,ULTMT_PRNT_UNDRTKNG_PRTY_RFRNC_DT,ULTMT_PRNT_UNDRTKNG_PRTY_RFRNC_DT,Ultimate parent undertaking Party Reference date,DT,The date the data refers to.,ULTMT_PRNT_UNDRTKNG_PRTY_RFRNC_DT,
ECB,ULTMT_PRNT_UNDRTKNG_PRTY_RPRTNG_AGNT_ID,ULTMT_PRNT_UNDRTKNG_PRTY_RPRTNG_AGNT_ID,Ultimate parent undertaking Party Reporting agent identifier,STRNG,Identifier of the reporting agent.,ULTMT_PRNT_UNDRTKNG_PRTY_RPRTNG_AGNT_ID,
ECB,UNDRLYNG_RSDL_MTRTY,UNDRLYNG_RSDL_MTRTY,Underlying residual maturity,RL,"Where required, the underlying residual maturity to which the sensitivity is wwa created. Required when we consider that the sensitivity came from a change in a volatility surface.",UNDRLYNG_RSDL_MTRTY,
ECB,UPU_SYSTM_PRTY_TYP,UPU_SYSTM_PRTY_TYP,Registered postal code system party type,PRTY_TYP_ADDRSS,Registered postal code system party type,UPU_SYSTM_PRTY_TYP,
ECB,VG_SNSTVTY,VG_SNSTVTY,Vega sensitivity,RL,"The sensitivity, as an amount (e.g. 100 dollars).",VG_SNSTVTY,
ECB,YR,YR,Year,DT,The year.,YR,
ECB,ABS_SCRTY_ID,ABS_SCRTY_ID,Asset backed security Security identifier,STRNG,The security identifier of the involved asset backed security.,ABS_SCRTY_ID,
ECB,ABS_SCRTY_RFRNC_DT,ABS_SCRTY_RFRNC_DT,Asset backed security Security Reference date,DT,The date the data refers to.,ABS_SCRTY_RFRNC_DT,
ECB,ABS_SCRTY_RPRTNG_AGNT_ID,ABS_SCRTY_RPRTNG_AGNT_ID,Asset backed security Security Reporting agent identifier,STRNG,Identifier of the reporting agent.,ABS_SCRTY_RPRTNG_AGNT_ID,
ECB,ABSTRCT_INSTRMNT_RL_TYP,ABSTRCT_INSTRMNT_RL_TYP,Abstract instrument role type,ABSTRCT_INSTRMNT_RL_TYP,A discriminator to distinguish between Instrument role and OTC derivative role.,ABSTRCT_INSTRMNT_RL_TYP,
ECB,ACCNTNG_HDG_INDCTR,ACCNTNG_HDG_INDCTR,Accounting hedge indicator,ACCNTNG_HDG_INDCTR,An indicator specifying if the hedge is considered an accounting hedge or not.,ACCNTNG_HDG_INDCTR,
ECB,ACCNTNG_STNDRD_CNLDTD_RPRTNG,ACCNTNG_STNDRD_CNLDTD_RPRTNG,Accounting standard for consolidated reporting,ACCNTNG_FRMWRK,Accounting standard for consolidated reporting is the accounting standard used by the Reporting agent internal group role for cons reporting.,ACCNTNG_STNDRD_CNLDTD_RPRTNG,
ECB,ACCNTNG_STNDRD_SOLO_RPRTNG,ACCNTNG_STNDRD_SOLO_RPRTNG,Accounting standard for solo reporting,ACCNTNG_FRMWRK,Accounting standard for solo reporting is the accounting standard used by the Reporting agent internal group role for solo reporting.,ACCNTNG_STNDRD_SOLO_RPRTNG,
ECB,ACCNTNG_STNDRD_STTSTCL_RPRTNG,ACCNTNG_STNDRD_STTSTCL_RPRTNG,Accounting standard for statistical reporting,ACCNTNG_FRMWRK,Accounting standard for statistical reporting is the accounting standard used by the Reporting agent internal group role to report statistical data.,ACCNTNG_STNDRD_STTSTCL_RPRTNG,
ECB,ACCNTNG_TRTMNT_CRR,ACCNTNG_TRTMNT_CRR,Accounting treatment (CRR Group),CNSLDTN_MTHD,"The accounting treatment of the subsidiary, joint venture or associate with respect to the CRR group.",ACCNTNG_TRTMNT_CRR,
ECB,ACCNTNG_TRTMNT_IFRS,ACCNTNG_TRTMNT_IFRS,Accounting treatment (IFRS Group),CNSLDTN_MTHD,"The accounting treatment of the subsidiary, joint venture or associate with respect to the IFRS group.",ACCNTNG_TRTMNT_IFRS,
ECB,ADVNC_INSTRMNT_ID,ADVNC_INSTRMNT_ID,Advance Instrument identifier,STRNG,The instrument identifier of the involved Advance.,ADVNC_INSTRMNT_ID,
ECB,ADVNC_INSTRMNT_RFRNC_DT,ADVNC_INSTRMNT_RFRNC_DT,Advance Instrument Reference date,DT,The date the data refers to.,ADVNC_INSTRMNT_RFRNC_DT,
ECB,ADVNC_INSTRMNT_RPRTNG_AGNT_ID,ADVNC_INSTRMNT_RPRTNG_AGNT_ID,Advance Instrument Reporting agent identifier,STRNG,Identifier of the reporting agent.,ADVNC_INSTRMNT_RPRTNG_AGNT_ID,
ECB,ADVNC_TYP,ADVNC_TYP,Advance type,TYP_INSTRMNT,"A discriminator to distinguish between suspense items, transit items and other advances.",ADVNC_TYP,
ECB,AGRCLTR_LND_INDCTR,AGRCLTR_LND_INDCTR,Agriculture land indicator,TYP_PRTCTN,Agriculture land indicator distinguishes Commercial real estate collateral related to land basd on whether the land includes agriculture or not.,AGRCLTR_LND_INDCTR,
ECB,ALLCTD_UNSD_CLLTRL_VL,ALLCTD_UNSD_CLLTRL_VL,Allocated unused collateral value,RL,"Allocated unused collateral value is an amount that expresses the protection value that is not used for risk mitigation and, for FINREP reporting purposes is allocated to a specific Loan (excluding repurchase agreement) and advance.",ALLCTD_UNSD_CLLTRL_VL,
ECB,APPRCH_CRDT_QLTY_STTS,APPRCH_CRDT_QLTY_STTS,Assessment approach for credit quality status,APPRCH_CRDT_QLTY_STTS,"Approach chosen by the institution to apply the definitions of default, according to Article 178 of Regulation (EU) No 575/2013, and of non-performing, according to Regulation (EU) No 680/2014, Annex V, Part 2.154.",APPRCH_CRDT_QLTY_STTS,
ECB,ASSCT_OTHR_ORGNSTN_PRTY_ID,ASSCT_OTHR_ORGNSTN_PRTY_ID,Associate Other organisation Party identifier,STRNG,The party identifier of the involved associate.,ASSCT_OTHR_ORGNSTN_PRTY_ID,
ECB,ASSNGND_DBTR_LGL_PRSN_PRTY_ID,ASSNGND_DBTR_LGL_PRSN_PRTY_ID,Assigned debtor Legal person Party identifier,STRNG,The party identifier of the involved assigned debtor.,ASSNGND_DBTR_LGL_PRSN_PRTY_ID,
ECB,ASSNGND_DBTR_LGL_PRSN_PRTY_RFRNC_DT,ASSNGND_DBTR_LGL_PRSN_PRTY_RFRNC_DT,Assigned debtor Legal person Party Reference date,DT,The date the data refers to.,ASSNGND_DBTR_LGL_PRSN_PRTY_RFRNC_DT,
ECB,ASSNGND_DBTR_LGL_PRSN_PRTY_RPRTNG_AGNT_ID,ASSNGND_DBTR_LGL_PRSN_PRTY_RPRTNG_AGNT_ID,Assigned debtor Legal person Party Reporting agent identifier,STRNG,Identifier of the reporting agent.,ASSNGND_DBTR_LGL_PRSN_PRTY_RPRTNG_AGNT_ID,
ECB,ASSNGND_DBTR_LGL_PRSN_RL_TYP,ASSNGND_DBTR_LGL_PRSN_RL_TYP,Assigned debtor Legal person role type,ENTTY_RL_TYP,The assigned debtor party role.,ASSNGND_DBTR_LGL_PRSN_RL_TYP,
ECB,ASST_BCKD_SCRTY_ID,ASST_BCKD_SCRTY_ID,Asset backed Security identifier,STRNG,An identifier to uniquely identify each security.,ASST_BCKD_SCRTY_ID,
ECB,ASST_BCKD_SCRTY_RFRNC_DT,ASST_BCKD_SCRTY_RFRNC_DT,Asset backed Security Reference date,DT,The date the data refers to.,ASST_BCKD_SCRTY_RFRNC_DT,
ECB,ASST_BCKD_SCRTY_RPRTNG_AGNT_ID,ASST_BCKD_SCRTY_RPRTNG_AGNT_ID,Asset backed Security Reporting agent identifier,STRNG,Identifier of the reporting agent.,ASST_BCKD_SCRTY_RPRTNG_AGNT_ID,
ECB,ASST_PL_ID,ASST_PL_ID,Asset pool identifier,STRNG,An identifier to uniquely identify each asset pool.,ASST_PL_ID,
ECB,ASST_PL_RFRNC_DT,ASST_PL_RFRNC_DT,Asset pool Reference date,DT,The date the data refers to.,ASST_PL_RFRNC_DT,
ECB,ASST_PL_RPRTNG_AGNT_ID,ASST_PL_RPRTNG_AGNT_ID,Asset pool Reporting agent identifier,STRNG,Identifier of the reporting agent.,ASST_PL_RPRTNG_AGNT_ID,
ECB,ASST_PL_TYP,ASST_PL_TYP,Asset pool (subject to securitisation and other credit transfer) type,ASST_PL_TYP,"A discriminator to distinguish between asset pools for securitisations, covered bond programs and other credit transfers.",ASST_PL_TYP,
ECB,BCKT_ID,BCKT_ID,Bucket identifier,STRNG,"The bucket identifier, for example the currency for interest rate risk factors.",BCKT_ID,
ECB,BLNC_SHT_NTTNG_ID,BLNC_SHT_NTTNG_ID,Balance sheet netting identifier,STRNG,An identifier to uniquely identify each a balance sheet netting.,BLNC_SHT_NTTNG_ID,
ECB,BLNC_SHT_NTTNG_RFRNC_DT,BLNC_SHT_NTTNG_RFRNC_DT,Balance sheet netting Reference date,DT,The date the data refers to.,BLNC_SHT_NTTNG_RFRNC_DT,
ECB,BLNC_SHT_NTTNG_RPRTNG_AGNT_ID,BLNC_SHT_NTTNG_RPRTNG_AGNT_ID,Balance sheet netting Reporting agent identifier,STRNG,Identifier of the reporting agent.,BLNC_SHT_NTTNG_RPRTNG_AGNT_ID,
ECB,BLNC_SHT_RCGNSD_ETD_LBLTY_PSTN_RL_TYP,BLNC_SHT_RCGNSD_ETD_LBLTY_PSTN_RL_TYP,Balance sheet recognised exchange tradable derivative liability position type,EXCHNG_TRDBL_DRVTV_PSTN_RL_TYP,Balance sheet recognised exchange tradable derivative liability position type,BLNC_SHT_RCGNSD_ETD_LBLTY_PSTN_RL_TYP,
ECB,BLNC_SHT_RCGNSD_EXCHNG_TRDBL_DRVTV_ASST_PSTN_TYP,BLNC_SHT_RCGNSD_EXCHNG_TRDBL_DRVTV_ASST_PSTN_TYP,Balance sheet recognised exchange tradable derivative asset position type,EXCHNG_TRDBL_DRVTV_PSTN_RL_TYP,A discriminator to distinguish between different types of Balance sheet recognised exchange tradable derivative asset positions.,BLNC_SHT_RCGNSD_EXCHNG_TRDBL_DRVTV_ASST_PSTN_TYP,
ECB,BLNC_SHT_RCGNSD_FFNCL_ASST_INSTRMNT_FR_VL_TYP,BLNC_SHT_RCGNSD_FFNCL_ASST_INSTRMNT_FR_VL_TYP,Balance sheet recognised financial asset instrument by fair value type,ABSTRCT_INSTRMNT_RL_TYP,A discriminator to distinguish between different types of Balance sheet recognised financial asset instruments by fair value.,BLNC_SHT_RCGNSD_FFNCL_ASST_INSTRMNT_FR_VL_TYP,
ECB,BLNC_SHT_RCGNSD_FNNCL_ASST_INSTRMNT_TYP,BLNC_SHT_RCGNSD_FNNCL_ASST_INSTRMNT_TYP,Balance sheet recognised financial asset instrument type,ABSTRCT_INSTRMNT_RL_TYP,A discriminator to distinguish between balance sheet recognised financial asset instruments according to IFRS and nGAAP.,BLNC_SHT_RCGNSD_FNNCL_ASST_INSTRMNT_TYP,
ECB,BLNC_SHT_RCGNSD_FNNCL_LBLTY_INSTRMNT_TYP,BLNC_SHT_RCGNSD_FNNCL_LBLTY_INSTRMNT_TYP,Balance sheet recognised financial liability instrument type,ABSTRCT_INSTRMNT_RL_TYP,A discriminator to distinguish between fair valued and non-fair valued balance sheet recognised financial liability instruments.,BLNC_SHT_RCGNSD_FNNCL_LBLTY_INSTRMNT_TYP,
ECB,BNFCRY_PRTY_ID,BNFCRY_PRTY_ID,Beneficiary Party identifier,STRNG,The party identifier of the beneficiary.,BNFCRY_PRTY_ID,
ECB,BNFCRY_PRTY_RFRNC_DT,BNFCRY_PRTY_RFRNC_DT,Beneficiary Party Reference date,DT,The date the data refers to.,BNFCRY_PRTY_RFRNC_DT,
ECB,BNFCRY_PRTY_RL_TYP,BNFCRY_PRTY_RL_TYP,Beneficiary Party role type,ENTTY_RL_TYP,The beneficiary party role.,BNFCRY_PRTY_RL_TYP,
ECB,BNFCRY_PRTY_RPRTNG_AGNT_ID,BNFCRY_PRTY_RPRTNG_AGNT_ID,Beneficiary Party Reporting agent identifier,STRNG,Identifier of the reporting agent.,BNFCRY_PRTY_RPRTNG_AGNT_ID,
ECB,BRRWR_PRTY_ID,BRRWR_PRTY_ID,Borrower Party identifier,STRNG,The party identifier of the involved borrower.,BRRWR_PRTY_ID,
ECB,BRRWR_PRTY_RFRNC_DT,BRRWR_PRTY_RFRNC_DT,Borrower Party Reference date,DT,The date the data refers to.,BRRWR_PRTY_RFRNC_DT,
ECB,BRRWR_PRTY_RL_TYP,BRRWR_PRTY_RL_TYP,Borrower Party role type,ENTTY_RL_TYP,The borrower party role.,BRRWR_PRTY_RL_TYP,
ECB,BRRWR_PRTY_RPRTNG_AGNT_ID,BRRWR_PRTY_RPRTNG_AGNT_ID,Borrower Party Reporting agent identifier,STRNG,Identifier of the reporting agent.,BRRWR_PRTY_RPRTNG_AGNT_ID,
ECB,BS_CRRNCY,BS_CRRNCY,Base currency,CRRNCY,The currency code according to ISO4217.,BS_CRRNCY,
ECB,BYR_PRTY_ID,BYR_PRTY_ID,Buyer Party identifier,STRNG,The party identifier of the involved buyer.,BYR_PRTY_ID,
ECB,BYR_PRTY_RFRNC_DT,BYR_PRTY_RFRNC_DT,Buyer Party Reference date,DT,The date the data refers to.,BYR_PRTY_RFRNC_DT,
ECB,BYR_PRTY_RL_TYP,BYR_PRTY_RL_TYP,Buyer Party role type,ENTTY_RL_TYP,The buyer party role.,BYR_PRTY_RL_TYP,
ECB,BYR_PRTY_RPRTNG_AGNT_ID,BYR_PRTY_RPRTNG_AGNT_ID,Buyer Party Reporting agent identifier,STRNG,Identifier of the reporting agent.,BYR_PRTY_RPRTNG_AGNT_ID,
ECB,CLLTRL_ANNX_PRTCTN_ARRNGMNT_RFRNC_DT,CLLTRL_ANNX_PRTCTN_ARRNGMNT_RFRNC_DT,Collateral annex Protection arrangement Reference date,DT,The date the data refers to.,CLLTRL_ANNX_PRTCTN_ARRNGMNT_RFRNC_DT,
ECB,CLLTRL_ANNX_PRTCTN_ARRNGMNT_RPRTNG_AGNT_ID,CLLTRL_ANNX_PRTCTN_ARRNGMNT_RPRTNG_AGNT_ID,Collateral annex Protection arrangement Reporting agent identifier,STRNG,Identifier of the reporting agent.,CLLTRL_ANNX_PRTCTN_ARRNGMNT_RPRTNG_AGNT_ID,
ECB,CLLTRL_ANNX_PRTCTN_ID,CLLTRL_ANNX_PRTCTN_ID,Collateral annex Protection arrangement identifier,STRNG,Collateral annex Protection arrangement identifier,CLLTRL_ANNX_PRTCTN_ID,
ECB,CLLTRL_ID,CLLTRL_ID,Collateral identifier,STRNG,An identifier to uniquely identify each collateral.,CLLTRL_ID,
ECB,CLLTRL_RCVD_INSTRMNT_ID,CLLTRL_RCVD_INSTRMNT_ID,Collateral received Instrument identifier,STRNG,The instrument identifier of the involved collateral received instrument.,CLLTRL_RCVD_INSTRMNT_ID,
ECB,CLLTRL_RCVD_INSTRMNT_RFRNC_DT,CLLTRL_RCVD_INSTRMNT_RFRNC_DT,Collateral received Instrument Reference date,DT,The date the data refers to.,CLLTRL_RCVD_INSTRMNT_RFRNC_DT,
ECB,CLLTRL_RCVD_INSTRMNT_RL_TYP,CLLTRL_RCVD_INSTRMNT_RL_TYP,Collateral received Instrument role type,ABSTRCT_INSTRMNT_RL_TYP,The collateral received instrument role.,CLLTRL_RCVD_INSTRMNT_RL_TYP,
ECB,CLLTRL_RCVD_INSTRMNT_RPRTNG_AGNT_ID,CLLTRL_RCVD_INSTRMNT_RPRTNG_AGNT_ID,Collateral received Instrument Reporting agent identifier,STRNG,Identifier of the reporting agent.,CLLTRL_RCVD_INSTRMNT_RPRTNG_AGNT_ID,
ECB,CLLTRL_RCVD_INSTRMNT_TYP,CLLTRL_RCVD_INSTRMNT_TYP,Collateral received instrument type,ABSTRCT_INSTRMNT_RL_TYP,Collateral received instrument type,CLLTRL_RCVD_INSTRMNT_TYP,
ECB,CLLTRL_RFRNC_DT,CLLTRL_RFRNC_DT,Collateral Reference date,DT,The date the data refers to.,CLLTRL_RFRNC_DT,
ECB,CLLTRL_RPRTNG_AGNT_ID,CLLTRL_RPRTNG_AGNT_ID,Collateral Reporting agent identifier,STRNG,Identifier of the reporting agent.,CLLTRL_RPRTNG_AGNT_ID,
ECB,CLLTRL_TYP,CLLTRL_TYP,Collateral type,TYP_PRTCTN,A discriminator to distinguish between financial and physical collateral.,CLLTRL_TYP,
ECB,CLRNG_MMBR_ORGNSTN_PRTY_ID,CLRNG_MMBR_ORGNSTN_PRTY_ID,Clearing member Organisation Party identifier,STRNG,The party identifier of the involved clearing member.,CLRNG_MMBR_ORGNSTN_PRTY_ID,
ECB,CLRNG_MMBR_ORGNSTN_PRTY_RFRNC_DT,CLRNG_MMBR_ORGNSTN_PRTY_RFRNC_DT,Clearing member Organisation Party Reference date,DT,The date the data refers to.,CLRNG_MMBR_ORGNSTN_PRTY_RFRNC_DT,
ECB,CLRNG_MMBR_ORGNSTN_PRTY_RPRTNG_AGNT_ID,CLRNG_MMBR_ORGNSTN_PRTY_RPRTNG_AGNT_ID,Clearing member Organisation Party Reporting agent identifier,STRNG,Identifier of the reporting agent.,CLRNG_MMBR_ORGNSTN_PRTY_RPRTNG_AGNT_ID,
ECB,CLRNG_MMBR_ORGNSTN_RL_TYP,CLRNG_MMBR_ORGNSTN_RL_TYP,Clearing member Organisation role type,ENTTY_RL_TYP,The clearing member party role.,CLRNG_MMBR_ORGNSTN_RL_TYP,
ECB,CMMDTY_CLLTRL_TYP,CMMDTY_CLLTRL_TYP,Commodity collateral type,TYP_PRTCTN,A discriminator to distinguish between gold and other commodity collateral.,CMMDTY_CLLTRL_TYP,
ECB,CMMDTY_TYP,CMMDTY_TYP,Commodity type,CMMDTY_TYP_FRTB,"The type of commodity, taken from Commodity Type Domain",CMMDTY_TYP,
ECB,CMMRCL_RL_ESTT_LN_INDCTR,CMMRCL_RL_ESTT_LN_INDCTR,Commercial real estate loan indicator,CMMRCL_RL_ESTT_LN_INDCTR,A Commercial real estate loan indicator distinguishes Loan (excluding repurchase agreement) derived data whether it is a commercial real estate loan or not.,CMMRCL_RL_ESTT_LN_INDCTR,
ECB,CMMRCL_RL_ESTT_OFFCS_CMMRCL_PRMSS_CLLTRL_TYP,CMMRCL_RL_ESTT_OFFCS_CMMRCL_PRMSS_CLLTRL_TYP,Commercial real estate and offices and commercial premises collateral type,TYP_PRTCTN,Commercial real estate and offices and commercial premises collateral type distinguishes Commercial real estate and offices and commercial premises collateral according to their type.,CMMRCL_RL_ESTT_OFFCS_CMMRCL_PRMSS_CLLTRL_TYP,
ECB,CNTR_BNK_PRVT_SCTR_CMPNY_PRTY_ID,CNTR_BNK_PRVT_SCTR_CMPNY_PRTY_ID,Central bank and private sector company Party identifier,STRNG,The party identifier of the involved linked enterprise.,CNTR_BNK_PRVT_SCTR_CMPNY_PRTY_ID,
ECB,CNTRL_BNK_PRVT_SCTR_CMPNY_PRTY_RFRNC_DT,CNTRL_BNK_PRVT_SCTR_CMPNY_PRTY_RFRNC_DT,Central bank and private sector company Party Reference date,DT,The date the data refers to.,CNTRL_BNK_PRVT_SCTR_CMPNY_PRTY_RFRNC_DT,
ECB,CNTRL_BNK_PRVT_SCTR_CMPNY_RPRTNG_AGNT_ID,CNTRL_BNK_PRVT_SCTR_CMPNY_RPRTNG_AGNT_ID,Central bank and private sector company Party Reporting agent identifier,STRNG,Identifier of the reporting agent.,CNTRL_BNK_PRVT_SCTR_CMPNY_RPRTNG_AGNT_ID,
ECB,CNTRL_BNK_PRVT_SCTR_CMPNY_TYP,CNTRL_BNK_PRVT_SCTR_CMPNY_TYP,Central bank and private sector company type,PRTY_TYP,The central bank and private sector company role.,CNTRL_BNK_PRVT_SCTR_CMPNY_TYP,
ECB,CNTRL_BNK_TYP,CNTRL_BNK_TYP,Central bank type,PRTY_TYP,European Cental Bank indicator disinguishes Central Banks between the one that is the European Central Bank (ECB) and all others that are not.,CNTRL_BNK_TYP,
ECB,CNTRY_CD,CNTRY_CD,Country code,GGRPHCL_ARS,The country code according to ISO3166.,CNTRY_CD,
ECB,CRDT_CRD_DBT_INSTRMNT_ID,CRDT_CRD_DBT_INSTRMNT_ID,Credit card debt Instrument identifier,STRNG,The instrument identifier of the involved credit card debt.,CRDT_CRD_DBT_INSTRMNT_ID,
ECB,CRDT_CRD_DBT_INSTRMNT_RFRNC_DT,CRDT_CRD_DBT_INSTRMNT_RFRNC_DT,Credit card debt Instrument Reference date,DT,The date the data refers to.,CRDT_CRD_DBT_INSTRMNT_RFRNC_DT,
ECB,CRDT_CRD_DBT_INSTRMNT_RPRTNG_AGNT_ID,CRDT_CRD_DBT_INSTRMNT_RPRTNG_AGNT_ID,Credit card debt Instrument Reporting agent identifier,STRNG,Identifier of the reporting agent.,CRDT_CRD_DBT_INSTRMNT_RPRTNG_AGNT_ID,
ECB,CRDT_FCLTY_ENTTY_RL_ASSGNMNT_TYP,CRDT_FCLTY_ENTTY_RL_ASSGNMNT_TYP,Credit facility Entity role assignment type,CRDT_FCLTY_ENTTY_RL_ASSGNMNT_TYP,"A discriminator to distinguish between assignment between a credit facility and a creditor, debtor or servicer.",CRDT_FCLTY_ENTTY_RL_ASSGNMNT_TYP,
ECB,CRDT_FCLTY_ID,CRDT_FCLTY_ID,Credit facility identifier,STRNG,An identifier to uniquely identify each credit facility.,CRDT_FCLTY_ID,
ECB,CRDT_FCLTY_RFRNC_DT,CRDT_FCLTY_RFRNC_DT,Credit facility Reference date,DT,The date the data refers to.,CRDT_FCLTY_RFRNC_DT,
ECB,CRDT_FCLTY_RPRTNG_AGNT_ID,CRDT_FCLTY_RPRTNG_AGNT_ID,Credit facility Reporting agent identifier,STRNG,Credit facility Reporting agent identifier,CRDT_FCLTY_RPRTNG_AGNT_ID,
ECB,CRDT_FCLTY_RSK_DT_ID,CRDT_FCLTY_RSK_DT_ID,Credit facility risk data identifier,STRNG,An identifier to uniquely identify each credit facility.,CRDT_FCLTY_RSK_DT_ID,
ECB,CRDT_FCLTY_RSK_DT_RFRNC_DT,CRDT_FCLTY_RSK_DT_RFRNC_DT,Credit facility risk data Reference date,DT,The date the data refers to.,CRDT_FCLTY_RSK_DT_RFRNC_DT,
ECB,CRDT_FCLTY_RSK_DT_RPRTNG_AGNT_ID,CRDT_FCLTY_RSK_DT_RPRTNG_AGNT_ID,Credit facility risk data Reporting agent identifier,STRNG,Identifier of the reporting agent.,CRDT_FCLTY_RSK_DT_RPRTNG_AGNT_ID,
ECB,CRDT_SPRD_RSK_CRDT_QLTY,CRDT_SPRD_RSK_CRDT_QLTY,Credit spread risk (CSR) credit quality,RTNG_GRD_CRDT_QLTY,The rating grade to which the credit spread risk curve realtes,CRDT_SPRD_RSK_CRDT_QLTY,
ECB,CRDT_SPRD_RSK_CRV_TYP,CRDT_SPRD_RSK_CRV_TYP,Credit spread risk (CSR) curve type,CSR_CRV_TYP,The type of Curve (CDS or BOND),CRDT_SPRD_RSK_CRV_TYP,
ECB,CRDT_TRNSFR_OTHR_SCRTSTN_CVRD_BND_PRGRM_ID,CRDT_TRNSFR_OTHR_SCRTSTN_CVRD_BND_PRGRM_ID,Credit transfer other than securitisation and covered bond program identifier,STRNG,An identifier to uniquely identify each credit transfer other than securitisation and covered bond program.,CRDT_TRNSFR_OTHR_SCRTSTN_CVRD_BND_PRGRM_ID,
ECB,CRDT_TRNSFR_OTHR_SCRTSTN_CVRD_BND_PRGRM_RFRNC_DT,CRDT_TRNSFR_OTHR_SCRTSTN_CVRD_BND_PRGRM_RFRNC_DT,Credit transfer other than securitisation and covered bond program Reference date,DT,The date the data refers to.,CRDT_TRNSFR_OTHR_SCRTSTN_CVRD_BND_PRGRM_RFRNC_DT,
ECB,CRDT_TRNSFR_OTHR_SCRTSTN_CVRD_BND_PRGRM_RPRTNG_AGNT_ID,CRDT_TRNSFR_OTHR_SCRTSTN_CVRD_BND_PRGRM_RPRTNG_AGNT_ID,Credit transfer other than securitisation and covered bond program Reporting agent identifier,STRNG,Identifier of the reporting agent.,CRDT_TRNSFR_OTHR_SCRTSTN_CVRD_BND_PRGRM_RPRTNG_AGNT_ID,
ECB,CRDTR_PRTY_ID,CRDTR_PRTY_ID,Creditor Party identifier,STRNG,The party identifier of the involved creditor.,CRDTR_PRTY_ID,
ECB,CRDTR_PRTY_RFRNC_DT,CRDTR_PRTY_RFRNC_DT,Creditor Party Reference date,DT,The date the data refers to.,CRDTR_PRTY_RFRNC_DT,
ECB,CRDTR_PRTY_RL_TYP,CRDTR_PRTY_RL_TYP,Creditor Party role type,ENTTY_RL_TYP,The creditor party role.,CRDTR_PRTY_RL_TYP,
ECB,CRDTR_PRTY_RPRTNG_AGNT_ID,CRDTR_PRTY_RPRTNG_AGNT_ID,Creditor Party Reporting agent identifier,STRNG,Identifier of the reporting agent.,CRDTR_PRTY_RPRTNG_AGNT_ID,
ECB,CRPRTN_TYP,CRPRTN_TYP,Corporation type,PRTY_TYP,A discriminator to distinguish between financial and non-financial corporations.,CRPRTN_TYP,
ECB,CRRNCY_RCRD,CRRNCY_RCRD,Currency of record,CRRNCY,Currency of record is the currency in which the vega sensitivity risk is measured.,CRRNCY_RCRD,
ECB,CRVTR_RSK_WGHT,CRVTR_RSK_WGHT,Curvature risk weight,RL,The weight associated with the curvature.,CRVTR_RSK_WGHT,
ECB,CRVTR_VLTN_DFFRNC,CRVTR_VLTN_DFFRNC,Curvature valuation difference,RL,"Curvature recorded as a difference between the normal valuation and  a revaluation after a small  increase OR decrease in an underyling risk factor, this is an amount interprted in the curency of record, e.g. 100 dollars. We only use carvature for non-linear instruments (e.g. options).",CRVTR_VLTN_DFFRNC,
ECB,CSH_HND_RFRNC_DT,CSH_HND_RFRNC_DT,Cash on hand Reference date,DT,The date the data refers to.,CSH_HND_RFRNC_DT,
ECB,CSH_HND_RPRTNG_AGNT_ID,CSH_HND_RPRTNG_AGNT_ID,Cash on hand Reporting agent identifier,STRNG,Identifier of the reporting agent.,CSH_HND_RPRTNG_AGNT_ID,
ECB,CSH_RSRV_AMNT,CSH_RSRV_AMNT,Cash reserve amount,MNTRY,The cash reserve of a factoring operation.,CSH_RSRV_AMNT,
ECB,CVRD_BND_PRGRM_RFRNC_DT,CVRD_BND_PRGRM_RFRNC_DT,Covered bond program Reference date,DT,The date the data refers to.,CVRD_BND_PRGRM_RFRNC_DT,
ECB,CVRD_BND_PRGRM_RPRTNG_AGNT_ID,CVRD_BND_PRGRM_RPRTNG_AGNT_ID,Covered bond program Reporting agent identifier,STRNG,Identifier of the reporting agent.,CVRD_BND_PRGRM_RPRTNG_AGNT_ID,
ECB,CVRD_BND_PRGRMM_ID,CVRD_BND_PRGRMM_ID,Covered bond programme identifier,STRNG,Covered bond programme identifier,CVRD_BND_PRGRMM_ID,
ECB,CVRD_BND_PRGRMM_RFRNC_DT,CVRD_BND_PRGRMM_RFRNC_DT,Covered bond programme Reference date,DT,The date the data refers to.,CVRD_BND_PRGRMM_RFRNC_DT,
ECB,CVRD_BND_PRGRMM_RPRTNG_AGNT_ID,CVRD_BND_PRGRMM_RPRTNG_AGNT_ID,Covered bond programme Reporting agent identifier,STRNG,Identifier of the reporting agent.,CVRD_BND_PRGRMM_RPRTNG_AGNT_ID,
ECB,CVRD_BND_SCRTY_ID,CVRD_BND_SCRTY_ID,Covered bond Security identifier,STRNG,The security identifier of the involved covered bond.,CVRD_BND_SCRTY_ID,
ECB,CVRD_BND_SCRTY_RFRNC_DT,CVRD_BND_SCRTY_RFRNC_DT,Covered bond Security Reference date,DT,The date the data refers to.,CVRD_BND_SCRTY_RFRNC_DT,
ECB,CVRD_BND_SCRTY_RPRTNG_AGNT_ID,CVRD_BND_SCRTY_RPRTNG_AGNT_ID,Covered bond Security Reporting agent identifier,STRNG,Identifier of the reporting agent.,CVRD_BND_SCRTY_RPRTNG_AGNT_ID,
