MAINTENANCE_AGENCY_ID,VARIABLE_ID,CODE,NAME,DOMAIN_ID,DESCRIPTION,PRIMARY_CONCEPT,IS_DECOMPOSED
ECB,SNRTY_TYP,SNRTY_TYP,Instrument seniority type,SNRTY_TYP,"The variable describes whether the instrument is guaranteed or not, its rank level and whether it is secured or not.",,
ECB,GRP_ID_TYP,GRP_ID_TYP,Group identifier type,TYP_ID,"The variable describes the type of identifier used as a Group ID, e.g. to specify that the RIAD code has been used for the Group ID.",,
ECB,EXPSR_CLSS,EXPSR_CLSS,Exposure class,EXPSR_CLSS,"Exposure class according to Regulation (EU) 575/2013, Article 112 Exposure class.",,
ECB,UNT_MSR_NV,UNT_MSR_NV,Unit of measure of the nominal value,RPRTNG_BSS,The variable describes the unit of measure of the nominal value,,
ECB,SCRTY_STTS,SCRTY_STTS,Security status,STTS,"It indicates the status of the security, i.e. whether the instrument is alive (active) or not alive (not active)",,
ECB,RPRTNG_BSS,RPRTNG_BSS,Reporting basis,RPRTNG_BSS,From NCBs,,
ECB,LGD_DWNTRNS,LGD_DWNTRNS,Loss given default (LGD) in downturns,RL,Loss given default (LGD) in downturns,,
ECB,ISSR_ID_TYP,ISSR_ID_TYP,Issuer identifier type,TYP_ID,"The variable describes the type of identifier used as Issuer ID, e.g. to specify that the RIAD code has been used for the Immediate parent ID.",,
ECB,NM_ENTTY_LE,NM_ENTTY_LE,Name (LE),STRNG,Full legal name of the counterparty.,NM_ENTTY,
ECB,CLLTRL_LCTN,CLLTRL_LCTN,Collateral geographical location,GGRPHCL_ARS,Collateral geographical location,,
ECB,TYP_GRNTR_ID,TYP_GRNTR_ID,Guarantor ID type,TYP_ID,Guarantor ID type,ID,
ECB,AREA_ISSR_SHS,AREA_ISSR_SHS,Area where the issuer is located,GGRPHCL_ARS,Area where the securities issuer is located. This is a union of countries and international organisations,,
ECB,ISSR_STTS_DTL,ISSR_STTS_DTL,Details on the issuer status,ISSR_STTS_DTL,"The variable provides additional information on the status of the issuer, e.g. reasons for not being alive anymore.",STTS,
ECB,INSTTTNL_SCTR,INSTTTNL_SCTR,Institutional sector,INSTTTNL_SCTR,"Institutional sectors in accordance with Regulation (EU) No 549/2013, Regulation (EU) No 575/2013 and Regulation (EU) No 1075/2013 of the European Central Bank (ECB/2013/40)(1).",,
ECB,NM_ENTTY_ISSR,NM_ENTTY_ISSR,Name,STRNG,Full legal name of the counterparty acting in the role of issuer of securities,,
ECB,RPRTNG_FRQNCY,RPRTNG_FRQNCY,Frequency of the reporting,FRQNCY,"Frequency of reporting due, if any.",,
ECB,DT_SCRTY_STTS,DT_SCRTY_STTS,Security status date,DT,Indicates the Date at which the Security Status has changed from alive to not-alive,,
ECB,SCRTY_RNK_LVL,SCRTY_RNK_LVL,Security rank level,SCRTY_RNK_LVL,It defines the security  ‘rank level’  how the instrument ranks in case of liquidation relatively compared to other instruments issued by the same issuer.,,
ECB,SCRTY_GRNT_LVL,SCRTY_GRNT_LVL,Security guarantee level,SCRTY_GRNT_LVL,"It defines the security ‘guarantee level’  whether the instrument is guaranteed by an entity different from the issuer, e.g. by the government. Further information may be found in the Guidance notes to reporting agents on SHS regulation (see https://www.ecb.europa.eu/pub/pdf/other/guidance_notes_to_reporting_agents_on_shs_regulation201705.en.pdf).",,
ECB,CRRNCY_UNT_MSR,CRRNCY_UNT_MSR,Unit of measure currency,CRRNCY,The variable describes the currency of the unit in which the amount is reported,CRRNCY,
ECB,DFLT_STTS_ISSR,DFLT_STTS_ISSR,Default status of the issuer,CRDT_QLTY,Default status of the issuer,,
ECB,SCRTY_STTS_DTL,SCRTY_STTS_DTL,Details on the security status,SCRTY_STTS_DTL,The variable provides additional information on the security status,,
ECB,TYP_INSTRMNT_ID,TYP_INSTRMNT_ID,Identifier type,TYP_INSTRMNT_ID,Codification type for the security,ID,
ECB,TYP_ASST_SCRTSTN,TYP_ASST_SCRTSTN,Type of asset provided as security,TYP_ASST_SCRTSTN,Type of asset provided as security.,,
ECB,LGL_ENTTY_ID_TYP,LGL_ENTTY_ID_TYP,Entity ID type,TYP_ID,The variable describes the entity ID type,,
ECB,INSTTTNL_SCTR_LE,INSTTTNL_SCTR_LE,Institutional sector (LE),INSTTTNL_SCTR,"Institutional sectors of the legal entity in accordance with Regulation (EU) No 549/2013, Regulation (EU) No 575/2013 and Regulation (EU) No 1075/2013 of the European Central Bank (ECB/2013/40)(1).",INSTTTNL_SCTR,
ECB,CRRNCY_UNT_MSR_NV,CRRNCY_UNT_MSR_NV,Currency of the nominal value,CRRNCY,The variable describes the currency of the nominal value,CRRNCY,
ECB,DT_DFLT_STTS_ISSR,DT_DFLT_STTS_ISSR,Date of the default status of the issuer,DT,Date of the default status of the issuer,,
ECB,GRP_INSTTTNL_SCTR,GRP_INSTTTNL_SCTR,Institutional sector of the group,INSTTTNL_SCTR,The variable describes the institutional sector of the head of the group according to ESA 2010,INSTTTNL_SCTR,
ECB,IMMDT_PRNT_ID_TYP,IMMDT_PRNT_ID_TYP,Immediate Parent identifier type,TYP_ID,"The variable describes the type of identifier used as Immediate parent ID, e.g. to specify that the RIAD code has been used for the Immediate parent ID.",,
ECB,ACCNTNG_FRMWRK_SL,ACCNTNG_FRMWRK_SL,Accounting framework for solo reporting,ACCNTNG_FRMWRK,Information on the accounting framework used by the entity when reporting on a solo basis. The information provided by NCAs is used to calculate the Accounting standard attribute to EBA (ACC_STD).,,
ECB,RPRTNG_INSTTTN_CD,RPRTNG_INSTTTN_CD,NA,RPRTNG_INSTTTN,NA,ENTTY_CD,
ECB,ECNMC_ACTVTY_ISSR,ECNMC_ACTVTY_ISSR,Economic activity of the issuer of securities,ECNMC_ACTVTY,"Classification of counterparties according to their economic activities, in accordance with the NACE revision 2 statistical classification as laid down in Regulation (EC) No 1893/2006 of the European Parliament and of the Council.",,
ECB,DFLT_STTS_INSTRMNT,DFLT_STTS_INSTRMNT,Default status of the instrument,CRDT_QLTY,Default status of the instrument,DFLT_STTS,
ECB,ORGNL_MTRTY_INTRVL,ORGNL_MTRTY_INTRVL,Original maturity,TM_INTRVL,Classification of [Original maturity in days] according to a set of predefined periods.,,
ECB,RPRTNG_AGNT_GRP_ID,RPRTNG_AGNT_GRP_ID,Reporting agent group identifier,STRNG,Reporting agent group identifier,,
ECB,INSTTTNL_SCTR_ISSR,INSTTTNL_SCTR_ISSR,Security issuer sector,INSTTTNL_SCTR,INSTTTNL_SCTR_ISSR,,
ECB,ACCNTNG_FRMWRK_CNS,ACCNTNG_FRMWRK_CNS,Accounting Framework for Cons Reporting,ACCNTNG_FRMWRK,Information on the accounting framework used by the entity when reporting on consolidated basis. The information provided by NCAs is used to calculate the Accounting standard attribute to EBA (ACC_STD).,,
ECB,PRMRY_ASST_CLSSFCTN,PRMRY_ASST_CLSSFCTN,Primary asset classification,PRMRY_ASST_CLSSFCTN,Truncated primary asset classification,,
ECB,IMMDT_PRNT_UNDRT_ID,IMMDT_PRNT_UNDRT_ID,Immediate parent undertaking identifier (identifier type: RIAD internal identifier),INTGR,"Counterparty identifier for the legal entity which is the immediate parent undertaking of the counterparty. If the counterparty has no parent undertaking, the counterparty identifier for the counterparty itself is to be reported. Parent undertaking has the same meaning as defined in Article 4(1)(15)(a) of Regulation (EU) No 575/2013.",ENTTY_RIAD_ID,
ECB,APPRCH_PRDNTL_PRPSS,APPRCH_PRDNTL_PRPSS,Approach for prudential purposes,APPRCH_PRDNTL_PRPSS,"In accordance with Article 107 of the CRR, Approach to which Standardized Approach provided for in Chapter 2 or, if permitted by the competent authorities in accordance with Article 143, the Internal Ratings Based Approach provided for in Chapter 3 to calculate their risk-weighted exposure amounts for the purposes of points (a) and (f) of Article 92(3).",,
ECB,INSTTTNL_SCTR_CNTRL,INSTTTNL_SCTR_CNTRL,Institutional sector control,INSTTTNL_SCTR_CNTRL,"Institutional sector control according to the subsectors defined in ESA 2010 Chapter 2 (private, public, …)",INSTTTNL_SCTR,
ECB,CRRNCY_TRNSCTN_RPRTD,CRRNCY_TRNSCTN_RPRTD,Currency of transaction reported,CRRNCY,Currency of transaction reported,,
ECB,DT_DFLT_STTS_INSTRMNT,DT_DFLT_STTS_INSTRMNT,Date of the default status of the instrument,DT,Date of the default status of the instrument,DT_DFLT_STTS,
ECB,RPRTNG_AGNT_LGL_ENTTY_ID,RPRTNG_AGNT_LGL_ENTTY_ID,Reporting agent legal entity identifier,STRNG,Reporting agent legal entity identifier,,
ECB,ERLY_RDMPTN_INCLSN_INDCTR,ERLY_RDMPTN_INCLSN_INDCTR,Early redempions inclusion indicator,ERLY_RDMPTN_INCLSN_INDCTR,The variable indicates whether early redemptions are included in the amount,,
ECB,PRDNTL_CNS_SCP_ISSR_INDCTR,PRDNTL_CNS_SCP_ISSR_INDCTR,Issuer part of the group for Prudential scope indicator,PRDNTL_CNS_SCP_ISSR_INDCTR,The variable indicates whether the issuer is part of the Group for prudential scope,,
ECB,ACCNTG_CNS_SCP_ISSR_INDCTR,ACCNTG_CNS_SCP_ISSR_INDCTR,Issuer part of the group for Accounting scope indicator,ACCNTG_CNS_SCP_ISSR_INDCTR,The variable indicates whether the issuer is part of the Group for accounting scope,,
ECB,ACCRD_INTRST_MRKT_VL_INDCTR,ACCRD_INTRST_MRKT_VL_INDCTR,Accrued interests for market values indicator,ACCRD_INTRST_MRKT_VL_INDCTR,The variable indicates whether interests were accrued for market value,,
ECB,TYP_ACCNTNG_ITM,TYP_ACCNTNG_ITM,Type of accounting item,TYP_ACCNTNG_ITM,Type of accounting item,,
ECB,TYP_MRKT,TYP_MRKT,Type of market,TYP_MRKT,Type of market,,
ECB,ENTTY_RIAD_CD_RPRTNG_AGNT,ENTTY_RIAD_CD_RPRTNG_AGNT,The RIAD code of the reporting agent,STRNG,The RIAD code of the reporting agent is the RIAD code assigned to the reporting agent. The reporting agent is the legal entity reporting the data.,ENTTY_RIAD_CD,
ECB,CNTRY,CNTRY,Country of residence,GGRPHCL_ARS,Counterparty’s country.,,
ECB,PATH,PATH,PATH,STRNG,PATH,,true
ECB,CODE,CODE,Code,STRNG,The code of this object.,,true
ECB,ROLE,ROLE,Role,TYP_RL,The role of the object.,,true
ECB,NAME,NAME,Name,STRNG,The name of this object.,,true
ECB,ORDER,ORDER,Order,INTGR,Order,,true
ECB,PHASE,PHASE,Phase,PHASE,The phase in a process.,,true
ECB,LEVEL,LEVEL,Level,INTGR,Level,,true
ECB,MX_VL,MX_VL,maxValue,RL,"The maxValue facet is used for inclusive and exclusive ranges, indicating what the upper bound of the range is. If this is used with an inclusive range, a valid value will be less than or equal to the value specified here. If the inclusive and exclusive data type is not specified (e.g. this facet is used with an integer data type), the value is assumed to be inclusive.",,true
ECB,PTTRN,PTTRN,pattern,STRNG,The pattern attribute holds any regular expression permitted in the implementation syntax following regex XML/XSD schema.,,true
ECB,MN_VL,MN_VL,minValue,RL,"The minValue facet is used for inclusive and exclusive ranges, indicating what the lower bound of the range is. If this is used with an inclusive range, a valid value will be greater than or equal to the value specified here. If the inclusive and exclusive data type is not specified (e.g. this facet is used with an integer data type), the value is assumed to be inclusive.",,true
ECB,COLOUR,COLOUR,Colour,STRNG,The colour of this object.,,
ECB,CUBE_ID,CUBE_ID,Cube identifier,STRNG,An identifier that uniquely identifies a cube in the dictionary.,ID,true
ECB,AXIS_ID,AXIS_ID,Axis identifier,STRNG,Axis identifier,ID,true
ECB,IS_FLOW,IS_FLOW,Is flow,BLN,Is flow,,true
ECB,ARTICLE,ARTICLE,Article,STRNG,Article,,true
ECB,FILTERS,FILTERS,Filters,STRNG,"A Cube can represent only a subset of the information provided by the linked dataset. In such cases, this field can or should be populated to allow systems to query the underlying physical dataset to reproduce the logical content described by the Cube.",,true
ECB,VERSION,VERSION,Version,STRNG,The version of this object.,,true
ECB,CELL_ID,CELL_ID,Cell identifier,STRNG,Cell identifier,ID,true
ECB,FACET_ID,FACET_ID,Facet identifier,STRNG,An identifier that uniquely identifies a facet in the dictionary.,ID,true
ECB,MN_LNGTH,MN_LNGTH,minLength,INTGR,The minLength facet specifies the minimum and length of the value in characters.,,true
ECB,MX_LNGTH,MX_LNGTH,maxLength,INTGR,The maxLength facet specifies the maximum length of the value in characters.,,true
ECB,OPERATOR,OPERATOR,Operator,STRNG,Operator,,true
ECB,TABLE_ID,TABLE_ID,Table identifier,STRNG,An identifier that uniquely identifies a table in the dictionary.,ID,true
ECB,VALID_TO,VALID_TO,Valid to,DT,The end date of the validity interval (of this object).,,true
ECB,MEMBER_ID,MEMBER_ID,Member identifier,STRNG,An identifier that uniquely identifies a member in the dictionary.,ID,true
ECB,NODE_NAME,NODE_NAME,Node name,STRNG,Node name,,true
ECB,PUBLISHED,PUBLISHED,Published,BLN,Specifies if this object is published.,,true
ECB,NODE_CODE,NODE_CODE,Node code,STRNG,Node code,,true
ECB,CUBE_CODE,CUBE_CODE,Code of the Cube,STRNG,The code of the Cube. To be used to identify the Cube of interest. It can be found in the upper section of a Cube view in the SDD Navigator.,CODE,true
ECB,IS_LINKED,IS_LINKED,Is linked,BLN,Specifies if it is linked,,
ECB,CUBE_NAME,CUBE_NAME,Name of the Cube,STRNG,The name of the Cube.,NAME,true
ECB,DOMAIN_ID,DOMAIN_ID,Domain identifier,STRNG,An identifier that uniquely identifies a domain in the dictionary.,ID,true
ECB,IS_SOURCE,IS_SOURCE,Is source,BLN,Specifies if the object is considered a source.,,true
ECB,CUBE_TYPE,CUBE_TYPE,Cube type,CUBE_TYPE,Specifies the type of cube.,,true
ECB,DATA_TYPE,DATA_TYPE,Data type,STRNG,Data type,,true
ECB,IS_SHADED,IS_SHADED,Is shaded,BLN,Is shaded,,true
ECB,ALGORITHM,ALGORITHM,Algorithm,STRNG,Algorithm,,true
ECB,HYPERLINK,HYPERLINK,Hyperlink,STRNG,Hyperlink,,true
ECB,IS_LISTED,IS_LISTED,Is listed,BLN,Allows the distinction between subdomains that are described by Members (i.e. listed subdomains) and other subdomains (i.e. non-listed subdomains).,,true
ECB,IS_ALLOWED,IS_ALLOWED,Is allowed,BLN,Is allowed,,true
ECB,ELEMENT_ID,ELEMENT_ID,Element identifier,STRNG,Element identifier,ID,true
ECB,COMPARATOR,COMPARATOR,Comparator,STRNG,Comparator,,true
ECB,IS_NATURAL,IS_NATURAL,Is natural subdomain,BLN,"Specifies if this subdomain is natural (and therefore changes in the underlying members are always natural changes, e.g. countries)",,true
ECB,LEGAL_CODE,LEGAL_CODE,Legal code,STRNG,Legal code,,true
ECB,VALID_FROM,VALID_FROM,Valid from,DT,The start date of the validity interval (of this object).,,true
ECB,FACET_TYPE,FACET_TYPE,Facet type,TYP_FCT,The type of facet.,,true
ECB,MAPPING_ID,MAPPING_ID,Mapping identifier,STRNG,An identifier that uniquely identifies a mapping in the dictionary.,ID,true
ECB,EXPRESSION,EXPRESSION,Expression,STRNG,A valid expression.,,true
ECB,VARIABLE_ID,VARIABLE_ID,Variable identifier,STRNG,An identifier that uniquely identifies a variable in the dictionary.,ID,true
ECB,ENTITY_NAME,ENTITY_NAME,Name of the Entity,STRNG,The name of the Entity (Cube).,NAME,true
ECB,ENTITY_CODE,ENTITY_CODE,Code of the Entity,STRNG,The code of the Entity. To be used to identify the Entity of interest. It can be found in the upper section of a Entity view in the SDD Navigator.,CODE,true
ECB,ENTITY_TYPE,ENTITY_TYPE,Entity type,CUBE_TYPE,Specifies the type of entity.,,true
ECB,ORIENTATION,ORIENTATION,Orientation,STRNG,Orientation,,true
ECB,DESCRIPTION,DESCRIPTION,Description,STRNG,The discription of an object in the dictionary.,,true
ECB,MAPPING_TYPE,MAPPING_TYPE,Mapping type,TYP_MPPNG,Specifies the type of mapping.,,true
ECB,IS_OPEN_AXIS,IS_OPEN_AXIS,Is open axis,BLN,Is open axis,,true
ECB,SUBDOMAIN_ID,SUBDOMAIN_ID,Subdomain identifier,STRNG,An identifier that uniquely identifies a subdomain in the dictionary.,ID,true
ECB,IS_REFERENCE,IS_REFERENCE,Is reference,BLN,Is reference,,true
ECB,CUBE_LINK_ID,CUBE_LINK_ID,Cube link ID,STRNG,An identifier that uniquely identifies a Cube Link in the dictionary.,ID,true
ECB,FRAMEWORK_ID,FRAMEWORK_ID,Framework identifier,STRNG,An identifier that uniquely identifies a framework in the dictionary.,ID,true
ECB,TYPE_OF_NODE,TYPE_OF_NODE,Type of node,STRNG,The type of node.,,true
ECB,CUBE_VERSION,CUBE_VERSION,Cube version,STRNG,The version of the Cube.,VERSION,true
ECB,IS_MANDATORY,IS_MANDATORY,Is mandatory,BLN,Specifies if the object is mandatory.,,true
ECB,LEGAL_TEXT_ID,LEGAL_TEXT_ID,Legal text identifier,STRNG,Legal text identifier,ID,true
ECB,IS_ENUMERATED,IS_ENUMERATED,Is enumerated,BLN,Allows the distinction of domains that are described using Members (i.e. enumerated domains) and other domains (i.e. non-enumerated domains).,,true
ECB,CUBE_GROUP_ID,CUBE_GROUP_ID,Cube group identifier,STRNG,An identifier that uniquely identifies a cube group in the dictionary.,ID,true
ECB,CUBE_VALID_TO,CUBE_VALID_TO,Valid to of the Cube,DT,The ending validity date of the Cube.,VALID_TO,true
ECB,ATTRIBUTE_CODE,ATTRIBUTE_CODE,Code of the attribute,STRNG,The code of the the attribute/field (Variable).,CODE,true
ECB,PARENT_NODE_ID,PARENT_NODE_ID,Parent node identifier,STRNG,The identifier of the parent transformation node.,ID,true
ECB,ATTRIBUTE_NAME,ATTRIBUTE_NAME,Name of the attribute,STRNG,The name of the the attribute/field (Variable).,NAME,true
ECB,ENTITY_VERSION,ENTITY_VERSION,Entity version,STRNG,The version of the Entity (Cube).,VERSION,true
ECB,CUBE_LINK_NAME,CUBE_LINK_NAME,Cube link name,STRNG,The name of the Cube link,NAME,true
ECB,SOURCE_CUBE_ID,SOURCE_CUBE_ID,Source cube identifier,STRNG,The cube identifier of the source cube.,ID,true
ECB,CUBE_LINK_CODE,CUBE_LINK_CODE,Cube link code,STRNG,The code of the Cube link,CODE,true
ECB,TYPE_OF_SCHEME,TYPE_OF_SCHEME,Type of Scheme,TYPE_OF_SCHEME,The type of scheme in the BIRD process.,,true
ECB,CUBE_LINK_TYPE,CUBE_LINK_TYPE,Cube link type,STRNG,,,true
ECB,COMBINATION_ID,COMBINATION_ID,Combination identifier,STRNG,An identifier that uniquely identifies a combination in the dictionary,ID,true
ECB,IS_IMPLEMENTED,IS_IMPLEMENTED,Is implemented,BLN,Indicates whether the attribute is implemented in the physical dataset(s) or is to be considered as a logical attribute only.,,true
ECB,DIMENSION_TYPE,DIMENSION_TYPE,Dimension type,TYP_DMNSN,The cathegorization of a dimension.,,true
ECB,VARIABLE_SET_ID,VARIABLE_SET_ID,Variable set identifier,STRNG,An identifier that uniquely identifies a variable set in the dictionary.,ID,true
ECB,CUBE_MAPPING_ID,CUBE_MAPPING_ID,Cube mapping identifier,STRNG,An identifier that uniquely identifies a cube mapping in the dictionary.,ID,true
ECB,FOREIGN_CUBE_ID,FOREIGN_CUBE_ID,Foreign cube identifier,STRNG,The cube identifier of the foreign cube.,ID,true
ECB,PRIMARY_CUBE_ID,PRIMARY_CUBE_ID,Primary cube identifier,STRNG,The cube identifier of the primary cube.,ID,true
ECB,CUBE_VALID_FROM,CUBE_VALID_FROM,Valid from of the Cube,DT,The starting validity date of the Cube.,VALID_FROM,true
ECB,ATTRIBUTE_ORDER,ATTRIBUTE_ORDER,Order of the attribute,INTGR,The order of the attribute/field (Variable) in the Cube.,ORDER,true
ECB,CUBE_LINK_ORDER,CUBE_LINK_ORDER,Cube link order,INTGR,"The order of importance of the Cube link, in case multiple Cube links are available for the same primary Cube.",ORDER,true
ECB,PRIMARY_CONCEPT,PRIMARY_CONCEPT,Primary concept,STRNG,Primary concept,,true
ECB,ORDER_RELEVANCE,ORDER_RELEVANCE,Order Relevance,STRNG,Order in relevance for the related cube link,,true
ECB,ENTITY_VALID_TO,ENTITY_VALID_TO,Valid to of the Entity,DT,The ending validity date of the Entity.,VALID_TO,true
ECB,SYSTEM_DATA_CODE,SYSTEM_DATA_CODE,System data code,STRNG,"The physical CODE implemented in the related physical datasets. It may be different from the COMBINATION_ID/CODE of the related COMBINATION, which may only be a semantic-logical ID/CODE.",CODE,true
ECB,PARENT_MEMBER_ID,PARENT_MEMBER_ID,Parent member identifier,STRNG,Parent member identifier,ID,true
ECB,CUBE_DESCRIPTION,CUBE_DESCRIPTION,Description of the Cube,STRNG,The description of the Cube.,DESCRIPTION,true
ECB,FACET_VALUE_TYPE,FACET_VALUE_TYPE,Facet value type,TYP_FCT_VL,Facet value type,,true
ECB,PARENT_NODE_CODE,PARENT_NODE_CODE,Parent node code,STRNG,Parent node code,,true
ECB,AXIS_ORDINATE_ID,AXIS_ORDINATE_ID,Axis ordinate identifier,STRNG,Axis ordinate identifier,ID,true
ECB,CUBE_STRUCTURE_ID,CUBE_STRUCTURE_ID,Cube structure identifier,STRNG,An identifier that uniquely identifies a cube structure in the dictionary.,ID,true
ECB,CUBE_LINK_VERSION,CUBE_LINK_VERSION,Cube link version,STRNG,The version of the Cube link,VERSION,true
ECB,TARGET_MAPPING_ID,TARGET_MAPPING_ID,Target Mapping ID,STRNG,Target mapping of a variable set mapping,ID,true
ECB,FOREIGN_MEMBER_ID,FOREIGN_MEMBER_ID,Foreign member ID,STRNG,An identifier that uniquely identifies the related Foreign Member in the dictionary.,ID,true
ECB,LEGAL_DESCRIPTION,LEGAL_DESCRIPTION,Legal description,STRNG,Legal description,,true
ECB,FOREIGN_CUBE_NAME,FOREIGN_CUBE_NAME,Foreign Cube name,STRNG,The name of the Foreign linked Cube,NAME,true
ECB,ENTITY_VALID_FROM,ENTITY_VALID_FROM,Valid from of the Entity,DT,The starting validity date of the Entity.,VALID_FROM,true
ECB,IS_MAIN_HIERARCHY,IS_MAIN_HIERARCHY,Is main hierarchy,BLN,Specifies if it is the main hierarchy,,
ECB,SOURCE_MAPPING_ID,SOURCE_MAPPING_ID,Source Mapping ID,STRNG,Source mapping of a variable set mapping,ID,true
ECB,FOREIGN_CUBE_CODE,FOREIGN_CUBE_CODE,Foreign Cube code,STRNG,The code of the Foreign linked Cube,CODE,true
ECB,CUBE_HIERARCHY_ID,CUBE_HIERARCHY_ID,cube hierarchy identifier,STRNG,An identifier that uniquely identifies a cube hierarchy in the dictionary.,ID,true
ECB,TRANSFORMATION_ID,TRANSFORMATION_ID,Transformation identifier,STRNG,An identifier that uniquely identifies a transformation in the dictionary.,ID,true
ECB,PRIMARY_MEMBER_ID,PRIMARY_MEMBER_ID,Primary member ID,STRNG,An identifier that uniquely identifies the related Primary Member in the dictionary.,ID,true
ECB,PRIMARY_CUBE_CODE,PRIMARY_CUBE_CODE,Primary Cube code,STRNG,The code of the Primary linked Cube,CODE,true
ECB,MEMBER_MAPPING_ID,MEMBER_MAPPING_ID,Member mapping identifier,STRNG,An identifier that uniquely identifies a member mapping in the dictionary.,ID,true
ECB,PRIMARY_CUBE_NAME,PRIMARY_CUBE_NAME,Primary Cube name,STRNG,The name of the Primary linked Cube,NAME,true
ECB,OBSERVATION_VALUE,OBSERVATION_VALUE,Observation value,STRNG,Observation value,,
ECB,STARTING_MEMBER_ID,STARTING_MEMBER_ID,Starting member identifier,STRNG,Starting member identifier,ID,true
ECB,MEMBER_MAPPING_ROW,MEMBER_MAPPING_ROW,Member mapping row,INTGR,Member mapping row,,true
ECB,CUBE_VARIABLE_CODE,CUBE_VARIABLE_CODE,Cube variable code,STRNG,The cube variable code of a cube structure item in the dictionary.,,true
ECB,TRANSFORMATION_URL,TRANSFORMATION_URL,Transformation URL,STRNG,,,
ECB,CUBE_LINK_VALID_TO,CUBE_LINK_VALID_TO,Cube link valid to,DT,The ending validity of the Cube link,VALID_TO,true
ECB,IS_ABSTRACT_HEADER,IS_ABSTRACT_HEADER,Is abstract header,BLN,Is abstract header,,true
ECB,ENTITY_DESCRIPTION,ENTITY_DESCRIPTION,Description of the Entity,STRNG,The description of the Entity (Cube).,DESCRIPTION,true
ECB,ATTRIBUTE_DATA_TYPE,ATTRIBUTE_DATA_TYPE,Attribute data type simplified,DATA_TYPE_SIMPLIFIED,The data type of the attribute/field (Variable) simplified.,,true
ECB,CUBE_HIERARCHY_TYPE,CUBE_HIERARCHY_TYPE,Cube hierarchy type,STRNG,Specifies the type of cube hierarchy.,,true
ECB,DESTINATION_CUBE_ID,DESTINATION_CUBE_ID,Destination cube identifier,STRNG,The cube identifier of the destination cube.,ID,true
ECB,MEMBER_HIERARCHY_ID,MEMBER_HIERARCHY_ID,Member hierarchy identifier,STRNG,An identifier that uniquely identifies a member hierarchy in the dictionary.,ID,true
ECB,FOREIGN_MEMBER_NAME,FOREIGN_MEMBER_NAME,Foreign Member name,STRNG,The name of the linked Member (value) of the foreign Cube,NAME,true
ECB,FOREIGN_MEMBER_CODE,FOREIGN_MEMBER_CODE,Foreign Member code,STRNG,The code of the linked Member (value) of the foreign Cube,CODE,true
ECB,VARIABLE_MAPPING_ID,VARIABLE_MAPPING_ID,Variable mapping identifier,STRNG,An identifier that uniquely identifies a variable mapping in the dictionary.,ID,true
ECB,PRIMARY_MEMBER_CODE,PRIMARY_MEMBER_CODE,Primary Member code,STRNG,The code of the linked Member (value) of the primary Cube,CODE,true
ECB,CLASSIFICATION_TYPE,CLASSIFICATION_TYPE,Classification type,STRNG,,,
ECB,ATTRIBUTE_DOMAIN_ID,ATTRIBUTE_DOMAIN_ID,Domain identifier,STRNG,An identifier that uniquely identifies a domain in the dictionary.,ID,true
ECB,PRIMARY_MEMBER_NAME,PRIMARY_MEMBER_NAME,Primary Member name,STRNG,The name of the linked Member (value) of the primary Cube,NAME,true
ECB,CUBE_RELATIONSHIP_ID,CUBE_RELATIONSHIP_ID,Cube relationship identifier,STRNG,An identifier that uniquely identifies a cube relationship in the dictionary.,ID,true
ECB,BUSINESS_DESCRIPTION,BUSINESS_DESCRIPTION,Business description,STRNG,Business description,,true
ECB,CUBE_LINK_VALID_FROM,CUBE_LINK_VALID_FROM,Cube link valid from,DT,The starting validity of the Cube link,VALID_FROM,true
ECB,ATTRIBUTE_VALUE_NAME,ATTRIBUTE_VALUE_NAME,Name of the value for the attribute,STRNG,The name of the value that the attribute/field can assume. The value can be the Member of the Subdomain or the Variable if the attribute/field is associated to a Variable set.,NAME,true
ECB,ATTRIBUTE_VALUE_CODE,ATTRIBUTE_VALUE_CODE,Code of the value for the attribute,STRNG,The code of the value that the attribute/field can assume. The value can be the Member of the Subdomain or the Variable if the attribute/field is associated to a Variable set.,CODE,true
ECB,TYPE_OF_RELATIONSHIP,TYPE_OF_RELATIONSHIP,Type of relationship,TYPE_OF_RELATIONSHIP,The type of relationship between entities.,,true
ECB,MEMBER_LINK_VALID_TO,MEMBER_LINK_VALID_TO,Member link valid to,DT,The ending validity date of the Member link.,VALID_TO,true
ECB,FOREIGN_VARIABLE_NAME,FOREIGN_VARIABLE_NAME,Foreign Variable name,STRNG,The name of the linked attribute of the foreign Cube,NAME,true
ECB,FOREIGN_VARIABLE_CODE,FOREIGN_VARIABLE_CODE,Foreign Variable code,STRNG,The code of the linked attribute of the foreign Cube,CODE,true
ECB,MAINTENANCE_AGENCY_ID,MAINTENANCE_AGENCY_ID,Maintenance agency identifier,STRNG,An identifier that uniquely identifies a maintenance agency in the dictionary.,ID,true
