MAINTENANCE_AGENCY_ID,VARIABLE_ID,CODE,NAME,DOMAIN_ID,DESCRIPTION,PRIMARY_CONCEPT,IS_DECOMPOSED
ECB,IMMDT_PRNT_ENTRPRS_PRTY_RFRNC_DT,IMMDT_PRNT_ENTRPRS_PRTY_RFRNC_DT,Immediate parent enterprise Party Reference date,DT,Immediate parent enterprise reference date is the date the data of the Immediate Parent enterprise refers to in the Immediate parent enterprise assignment.,IMMDT_PRNT_ENTRPRS_PRTY_RFRNC_DT,
ECB,IMMDT_PRNT_ENTRPRS_PRTY_RL_TYP,IMMDT_PRNT_ENTRPRS_PRTY_RL_TYP,Immediate parent enterprise Party role type,ENTTY_RL_TYP,Immediate parent enterprise Party role type is the role type identifying the central bank and private sector company role type as Immediate parent enterprise.,IMMDT_PRNT_ENTRPRS_PRTY_RL_TYP,
ECB,IMMDT_PRNT_ENTRPRS_RPRTNG_AGNT_ID,IMMDT_PRNT_ENTRPRS_RPRTNG_AGNT_ID,Immediate parent Party enterprise Reporting agent identifier,STRNG,Immediate parent enterprise Party reporting agent identifier is the Identifier of the reporting agent that reports the Immediate parent enterprise in the Immediate parent enterprise assignment.,IMMDT_PRNT_ENTRPRS_RPRTNG_AGNT_ID,
ECB,IMMDT_PRNT_RGLTN_867_2016_INDCTR,IMMDT_PRNT_RGLTN_867_2016_INDCTR,Immediate parent according to AnaCredit indicator,IMMDT_PRNT_ANCRDT_INDCTR,"An indicator specifying if the immediate parent is the immediate parent according to Regulation (EU) 867/2016, data attribute Immediate parent undertaking identifier; ""Counterparty identifier for the legal entity which is the immediate parent undertaking of the counterparty. If the counterparty has no parent undertaking, the counterparty identifier for the counterparty itself is to be reported. Parent undertaking has the same meaning as defined in Article 4(1)(15)(a) of Regulation (EU) No 575/2013."".",IMMDT_PRNT_RGLTN_867_2016_INDCTR,
ECB,INSTRMNT_CLLTRL_RCVD_INSTRMNT_ASSGNMNT_TYP,INSTRMNT_CLLTRL_RCVD_INSTRMNT_ASSGNMNT_TYP,Instrument Collateral received instrument assignment type,INSTRMNT_CLLTRL_RCVD_INSTRMNT_ASSGNMNT_TYP,,INSTRMNT_CLLTRL_RCVD_INSTRMNT_ASSGNMNT_TYP,
ECB,INSTRMNT_ENTTY_RL_ASSGNMNT_TYP,INSTRMNT_ENTTY_RL_ASSGNMNT_TYP,Instrument Entity role assignment type,INSTRMNT_ENTTY_RL_ASSGNMNT_TYP,"A discriminator to distinguish between different assignments between instruments and party roles, for example deposit taking corporation deposit assignment.",INSTRMNT_ENTTY_RL_ASSGNMNT_TYP,
ECB,INSTRMNT_RFRNC_DT,INSTRMNT_RFRNC_DT,Instrument Reference date,DT,The date the data refers to.,INSTRMNT_RFRNC_DT,
ECB,INSTRMNT_RL_TYP,INSTRMNT_RL_TYP,Instrument role type,ABSTRCT_INSTRMNT_RL_TYP,"A discriminator to distinguish between different roles an instrument may act in. Examples are financial asset instrument, financial liability instrument.",INSTRMNT_RL_TYP,
ECB,INSTRMNT_RPRTNG_AGNT_ID,INSTRMNT_RPRTNG_AGNT_ID,Instrument Reporting agent identifier,STRNG,Identifier of the reporting agent.,INSTRMNT_RPRTNG_AGNT_ID,
ECB,INSTRMNT_TYP_ORGN,INSTRMNT_TYP_ORGN,Instrument type by origin,TYP_INSTRMNT,A discriminator to distinguish instrument by their type of origin. For example instruments arising from financial contracts or instruments arising from credit facilities.,INSTRMNT_TYP_ORGN,
ECB,INSTRMNT_TYP_PRDCT,INSTRMNT_TYP_PRDCT,Instrument type by product,TYP_INSTRMNT,"A discriminator to distinguish instruments by product. Examles are loans and advances, securities financing transactions, financial guarantees and other commitments or over the counter derivatives.",INSTRMNT_TYP_PRDCT,
ECB,INSTTNL_UNT_GRP_ID,INSTTNL_UNT_GRP_ID,Institutional unit Group identifier,STRNG,An identifier to uniquely identify each group.,INSTTNL_UNT_GRP_ID,
ECB,INSTTNL_UNT_GRP_RFRNC_DT,INSTTNL_UNT_GRP_RFRNC_DT,Institutional unit Group Reference date,DT,The date the data refers to.,INSTTNL_UNT_GRP_RFRNC_DT,
ECB,INSTTNL_UNT_GRP_RPRTNG_AGNT_ID,INSTTNL_UNT_GRP_RPRTNG_AGNT_ID,Institutional unit Group Reporting agent identifier,STRNG,Identifier of the reporting agent.,INSTTNL_UNT_GRP_RPRTNG_AGNT_ID,
ECB,INTL_IMPRMNT_STTS,INTL_IMPRMNT_STTS,Initial impairment status,CRDT_QLTY,"Initial imapirment status is the impairment status, recorded in the beginning of the financial year or at the initial recognition of the impairment of the exposure after the beginning of the financial year.",INTL_IMPRMNT_STTS,
ECB,INTRNL_CNSLDTN_GRP_TYP,INTRNL_CNSLDTN_GRP_TYP,Internal consolidation group type,GRP_TYP,A discriminator to distinguish between different types of consolidation groups. Examples are accounting consolidation group and prudential consolidation group.,INTRNL_CNSLDTN_GRP_TYP,
ECB,INTRNL_GRP_TYP,INTRNL_GRP_TYP,Internal group type,GRP_TYP,A discriminator to distinguish between different types of internal groups. Examples are institutional units of foreign branches or internal consolidation groups.,INTRNL_GRP_TYP,
ECB,INTRNTNL_ORGNSTN_GNRL_GVNMNT_TYP,INTRNTNL_ORGNSTN_GNRL_GVNMNT_TYP,International organisation and general government type,PRTY_TYP,A discriminator to distinguish between international organisations and general government.,INTRNTNL_ORGNSTN_GNRL_GVNMNT_TYP,
ECB,INVSTR_PRTY_ID,INVSTR_PRTY_ID,Investor Party identifier,STRNG,The party identifier of the involved investor.,INVSTR_PRTY_ID,
ECB,INVSTR_PRTY_RFRNC_DT,INVSTR_PRTY_RFRNC_DT,Investor Party Reference date,DT,The date the data refers to.,INVSTR_PRTY_RFRNC_DT,
ECB,INVSTR_PRTY_RL_TYP,INVSTR_PRTY_RL_TYP,Investor Party role type,ENTTY_RL_TYP,The investor role.,INVSTR_PRTY_RL_TYP,
ECB,INVSTR_PRTY_RPRTNG_AGNT_ID,INVSTR_PRTY_RPRTNG_AGNT_ID,Investor Party Reporting agent identifier,STRNG,Identifier of the reporting agent.,INVSTR_PRTY_RPRTNG_AGNT_ID,
ECB,ISSR_BSD_RTNG_SYSTM_TYP,ISSR_BSD_RTNG_SYSTM_TYP,Issuer based rating system type,RTNG_SYSTM_TYP,A discriminator to distinguish between central government and non-central government (issuer) based rating systems.,ISSR_BSD_RTNG_SYSTM_TYP,
ECB,ISSR_RFRNC_DT,ISSR_RFRNC_DT,Issuer Reference date,DT,The date the data refers to.,ISSR_RFRNC_DT,
ECB,ISSR_RL_TYP,ISSR_RL_TYP,Issuer role type,ENTTY_RL_TYP,"A discriminator to distinguish between different roles a party may act in. Examples are debtor, creditor, servicer.",ISSR_RL_TYP,
ECB,ISSR_RPRTNG_AGNT_ID,ISSR_RPRTNG_AGNT_ID,Issuer Reporting agent identifier,STRNG,Identifier of the reporting agent.,ISSR_RPRTNG_AGNT_ID,
ECB,JNT_VNTR_OTHR_ORGNSTN_PRTY_ID,JNT_VNTR_OTHR_ORGNSTN_PRTY_ID,Joint venture Other organisation Party identifier,STRNG,The party identifier of the joint venture.,JNT_VNTR_OTHR_ORGNSTN_PRTY_ID,
ECB,LGL_PRSN_PRTY_ID,LGL_PRSN_PRTY_ID,Legal person Party identifier,STRNG,The party identifier of the involved legal person.,LGL_PRSN_PRTY_ID,
ECB,LGL_PRSN_PRTY_RFRNC_DT,LGL_PRSN_PRTY_RFRNC_DT,Legal person Party Reference date,DT,The date the data refers to.,LGL_PRSN_PRTY_RFRNC_DT,
ECB,LGL_PRSN_PRTY_RPRTNG_AGNT_ID,LGL_PRSN_PRTY_RPRTNG_AGNT_ID,Legal person Party Reporting agent identifier,STRNG,Identifier of the reporting agent.,LGL_PRSN_PRTY_RPRTNG_AGNT_ID,
ECB,LGL_PRSN_RL_TYP,LGL_PRSN_RL_TYP,Legal person role type,ENTTY_RL_TYP,The legal person role.,LGL_PRSN_RL_TYP,
ECB,LGL_PRSN_TYP,LGL_PRSN_TYP,Legal person type,PRTY_TYP,"A discriminator to distinguish between different type of legal persons, e.g. assigned debtor.",LGL_PRSN_TYP,
ECB,LN_AND_ADVNC_TYP,LN_AND_ADVNC_TYP,Loan and advance type,TYP_INSTRMNT,A discriminator to distinguish between loans and advances.,LN_AND_ADVNC_TYP,
ECB,LN_DBTR_PRTY_ID,LN_DBTR_PRTY_ID,Loan debtor Party identifier,STRNG,The party identifier of the involved debtor.,LN_DBTR_PRTY_ID,
ECB,LN_DBTR_PRTY_RFRNC_DT,LN_DBTR_PRTY_RFRNC_DT,Loan debtor Party Reference date,DT,The date the data refers to.,LN_DBTR_PRTY_RFRNC_DT,
ECB,LN_DBTR_PRTY_RL_TYP,LN_DBTR_PRTY_RL_TYP,Loan debtor Party role type,ENTTY_RL_TYP,The party identifier of the involved debtor.,LN_DBTR_PRTY_RL_TYP,
ECB,LN_DBTR_PRTY_RPRTNG_AGNT_ID,LN_DBTR_PRTY_RPRTNG_AGNT_ID,Loan debtor Party Reporting agent identifier,STRNG,Identifier of the reporting agent.,LN_DBTR_PRTY_RPRTNG_AGNT_ID,
ECB,LN_EXCLDNG_RPRCHS_AGRMNT_INSTRMNT_ID,LN_EXCLDNG_RPRCHS_AGRMNT_INSTRMNT_ID,Loan (excluding repurchase agreement) Instrument identifier,STRNG,An identifier applied by the reporting agent to uniquely identify each instrument under a single contract. Each instrument must have one instrument identifier. This value will not change over time and cannot be used as the instrument identifier for any other instrument under the same contract.,LN_EXCLDNG_RPRCHS_AGRMNT_INSTRMNT_ID,
ECB,LN_EXCLDNG_RPRCHS_AGRMNT_INSTRMNT_RFRNC_DT,LN_EXCLDNG_RPRCHS_AGRMNT_INSTRMNT_RFRNC_DT,Loan (excluding repurchase agreement) Instrument Reference date,DT,The date the data refers to.,LN_EXCLDNG_RPRCHS_AGRMNT_INSTRMNT_RFRNC_DT,
ECB,LN_EXCLDNG_RPRCHS_AGRMNT_INSTRMNT_RPRTNG_AGNT_ID,LN_EXCLDNG_RPRCHS_AGRMNT_INSTRMNT_RPRTNG_AGNT_ID,Loan (excluding repurchase agreement) Instrument Reporting agent identifier,STRNG,Identifier of the reporting agent.,LN_EXCLDNG_RPRCHS_AGRMNT_INSTRMNT_RPRTNG_AGNT_ID,
ECB,LN_INSTRMNT_ID,LN_INSTRMNT_ID,Loan Instrument identifier,STRNG,The instrument identifier of the involved loan.,LN_INSTRMNT_ID,
ECB,LN_INSTRMNT_RFRNC_DT,LN_INSTRMNT_RFRNC_DT,Loan Instrument Reference date,DT,The date the data refers to.,LN_INSTRMNT_RFRNC_DT,
ECB,LN_INSTRMNT_RPRTNG_AGNT_ID,LN_INSTRMNT_RPRTNG_AGNT_ID,Loan Instrument Reporting agent identifier,STRNG,Identifier of the reporting agent.,LN_INSTRMNT_RPRTNG_AGNT_ID,
ECB,LN_TYP,LN_TYP,Loan type,TYP_INSTRMNT,"A discriminator to distinguish between different types of loans. Examples are financial leases, trade receivables, deposits.",LN_TYP,
ECB,LNDR_PRTY_ID,LNDR_PRTY_ID,Lender Party identifier,STRNG,The party identifier of the involved lender.,LNDR_PRTY_ID,
ECB,LNDR_PRTY_RFRNC_DT,LNDR_PRTY_RFRNC_DT,Lender Party Reference date,DT,The date the data refers to.,LNDR_PRTY_RFRNC_DT,
ECB,LNDR_PRTY_RL_TYP,LNDR_PRTY_RL_TYP,Lender Party role type,ENTTY_RL_TYP,The lender role.,LNDR_PRTY_RL_TYP,
ECB,LNDR_PRTY_RPRTNG_AGNT_ID,LNDR_PRTY_RPRTNG_AGNT_ID,Lender Party Reporting agent identifier,STRNG,Identifier of the reporting agent.,LNDR_PRTY_RPRTNG_AGNT_ID,
ECB,LNG_DBT_SCRTY_PSTN_PRDNTL_PRTFL_ASSGNMNT_ACCNTNG_CLSSFCTN_FNNCL_ASSTS_ASSGNMNT_TYP,LNG_DBT_SCRTY_PSTN_PRDNTL_PRTFL_ASSGNMNT_ACCNTNG_CLSSFCTN_FNNCL_ASSTS_ASSGNMNT_TYP,Long debt security position Prudential portfolio assignment Accounting classification for financial assets assignment type,LNG_SCRTY_PSTN_PRDNTL_PRTFL_ASSGNMNT_ACCNTNG_CLSSFCTN_FNNCL_ASSTS_ASSGNMNT_TYP,A discriminator to distinguish between debt securities and equity and fund securities.,LNG_DBT_SCRTY_PSTN_PRDNTL_PRTFL_ASSGNMNT_ACCNTNG_CLSSFCTN_FNNCL_ASSTS_ASSGNMNT_TYP,
ECB,LNG_EQTY_FND_SCRTY_PSTN_PRDNTL_PRTFL_ASSGNMNT_ACCNTNG_CLSSFCTN_FNNCL_ASSTS_ASSGNMNT_TYP,LNG_EQTY_FND_SCRTY_PSTN_PRDNTL_PRTFL_ASSGNMNT_ACCNTNG_CLSSFCTN_FNNCL_ASSTS_ASSGNMNT_TYP,Long equity or fund security position Prudential portfolio assignment Accounting classification for financial assets assignment type,LNG_SCRTY_PSTN_PRDNTL_PRTFL_ASSGNMNT_ACCNTNG_CLSSFCTN_FNNCL_ASSTS_ASSGNMNT_TYP,A discriminator to distinguish between debt securities and equity and fund securities.,LNG_EQTY_FND_SCRTY_PSTN_PRDNTL_PRTFL_ASSGNMNT_ACCNTNG_CLSSFCTN_FNNCL_ASSTS_ASSGNMNT_TYP,
ECB,LNG_SCRTY_PSTN_PRDNTL_PRTFL_ASSGNMNT_ACCNTNG_CLSSFCTN_FNNCL_ASSTS_ASSGNMNT_TYP,LNG_SCRTY_PSTN_PRDNTL_PRTFL_ASSGNMNT_ACCNTNG_CLSSFCTN_FNNCL_ASSTS_ASSGNMNT_TYP,Long security position Prudentiial Portfolio assignment Accounting classification for financial assets assignment type,LNG_SCRTY_PSTN_PRDNTL_PRTFL_ASSGNMNT_ACCNTNG_CLSSFCTN_FNNCL_ASSTS_ASSGNMNT_TYP,A discriminator to distinguish between debt securities and equity and fund securities.,LNG_SCRTY_PSTN_PRDNTL_PRTFL_ASSGNMNT_ACCNTNG_CLSSFCTN_FNNCL_ASSTS_ASSGNMNT_TYP,
ECB,LNG_SCRTY_PSTN_PRDNTL_PRTFL_ASSGNMNT_TYP,LNG_SCRTY_PSTN_PRDNTL_PRTFL_ASSGNMNT_TYP,Long security position Prudential portfolio assignment type,LNG_SCRTY_PSTN_PRDNTL_PRTFL_ASSGNMNT_TYP,A discriminator to distinguish between debt securities and equity and fund securities.,LNG_SCRTY_PSTN_PRDNTL_PRTFL_ASSGNMNT_TYP,
ECB,LNG_SCRTY_PSTN_TYP,LNG_SCRTY_PSTN_TYP,Long security position type,SCRTY_EXCHNG_TRDBL_DRVTV_PSTN_TYP,A discriminator to distinguish between debt securities and equity and fund securities.,LNG_SCRTY_PSTN_TYP,
ECB,LNKD_ENTRPRS_PRTY_ID,LNKD_ENTRPRS_PRTY_ID,Linked enterprise Party identifier,STRNG,The party identifier of the involved linked enterprise.,LNKD_ENTRPRS_PRTY_ID,
ECB,LNKD_ENTRPRS_PRTY_RL_TYP,LNKD_ENTRPRS_PRTY_RL_TYP,Linked enterprise Party role type,ENTTY_RL_TYP,Linked enterprise Party role type is the role type identifying the central bank and private sector company role type as Linked enterprise in the Linked enterprise assignment.,LNKD_ENTRPRS_PRTY_RL_TYP,
ECB,LNKD_ENTRPRS_RFRNC_DT,LNKD_ENTRPRS_RFRNC_DT,Linked enterprise Reference date,DT,Linked enterprise Reference date is the date the data of the Linked enterprise assignment refers to in the Linked enterprise assignment.,LNKD_ENTRPRS_RFRNC_DT,
ECB,LNKD_ENTRPRS_RPRTNG_AGNT_ID,LNKD_ENTRPRS_RPRTNG_AGNT_ID,Linked enterprise Reporting agent identifier,STRNG,Linked enterprise Party reporting agent identifier is the Identifier of the reporting agent that reports the linked enterprise in the Linked enterprise assignment.,LNKD_ENTRPRS_RPRTNG_AGNT_ID,
ECB,LOCOM_INDCTR,LOCOM_INDCTR,Lower of cost or market (LOCOM) indicator,LOCOM_INDCTR,An indicator specifying if an asset is classified as lower of cost or market (LOCOM).,LOCOM_INDCTR,
ECB,LS_PRTY_ID,LS_PRTY_ID,Lessee Party identifier,STRNG,An identifier that uniquely identifies a party.,LS_PRTY_ID,
ECB,LS_PRTY_RFRNC_DT,LS_PRTY_RFRNC_DT,Lessee Party Reference date,DT,The date the data refers to.,LS_PRTY_RFRNC_DT,
ECB,LS_PRTY_RL_TYP,LS_PRTY_RL_TYP,Lessee Party role type,ENTTY_RL_TYP,The lessee role.,LS_PRTY_RL_TYP,
ECB,LS_PRTY_RPRTNG_AGNT_ID,LS_PRTY_RPRTNG_AGNT_ID,Lessee Party Reporting agent identifier,STRNG,Identifier of the reporting agent.,LS_PRTY_RPRTNG_AGNT_ID,
ECB,LSSR_PRTY_ID,LSSR_PRTY_ID,Lessor Party identifier,STRNG,The party identifier of the involved lessor.,LSSR_PRTY_ID,
ECB,LSSR_PRTY_RFRNC_DT,LSSR_PRTY_RFRNC_DT,Lessor Party Reference date,DT,The date the data refers to.,LSSR_PRTY_RFRNC_DT,
ECB,LSSR_PRTY_RL_TYP,LSSR_PRTY_RL_TYP,Lessor Party role type,ENTTY_RL_TYP,The lessor role.,LSSR_PRTY_RL_TYP,
ECB,LSSR_PRTY_RPRTNG_AGNT_ID,LSSR_PRTY_RPRTNG_AGNT_ID,Lessor Party Reporting agent identifier,STRNG,Identifier of the reporting agent.,LSSR_PRTY_RPRTNG_AGNT_ID,
ECB,LST_NM,LST_NM,Last name,STRNG,The last name.,LST_NM,
ECB,LSTD_CNTRL_BNK_PRVT_SCTR_CMPNY_INDCTR,LSTD_CNTRL_BNK_PRVT_SCTR_CMPNY_INDCTR,Listed central bank and private sector company indicator,BLN,An indicator specifying is a security is listed or not.,LSTD_CNTRL_BNK_PRVT_SCTR_CMPNY_INDCTR,
ECB,LT_SSTNBL_VL,LT_SSTNBL_VL,Long-term sustainable value amount of the collateral,MNTRY,Long-term sustainable value amount of the collateral,LT_SSTNBL_VL,
ECB,MLTLTRL_DVLPMNT_BNK_INDCTR,MLTLTRL_DVLPMNT_BNK_INDCTR,Multilateral development bank indicator,MLTLTRL_DVLPMNT_BNK_INDCTR,Multilateral development bank indicator specifies if the International organisation is a multilateral development bank or not.,MLTLTRL_DVLPMNT_BNK_INDCTR,
ECB,MLTPL_FRBRNC_MSRS_INDCTR,MLTPL_FRBRNC_MSRS_INDCTR,Multiple forbearance measures in place indicator,MLTPL_FRBRNC_MSR_INDCTR,"Forbearance measures were granted in addition to already existing forbearance measures. It concerns forborne exposures under probation to which forbearance measures were applied in addition to forbearance measures granted at an earlier point in time, without the exposure having cured in between.",MLTPL_FRBRNC_MSRS_INDCTR,
ECB,MN_CRRNCY,MN_CRRNCY,Main currency,CRRNCY,The curve's main currency.,MN_CRRNCY,
ECB,MN_DBTR_INDCTR,MN_DBTR_INDCTR,Main debtor indicator,MN_DBTR_INDCTR,An indicator specifying if a debtor is the main debtor.,MN_DBTR_INDCTR,
ECB,MRKT_CPTLSTN_INDCTR,MRKT_CPTLSTN_INDCTR,Market capitalisation indicator,MRKT_CP,"Market capitalisation indicator classifies the Listed central bank and private sectory company as Large or Small market capitalisation. 

Market capitalisation, or ""market cap"", of the Listed central bank and private sector company is the sum of the market capitalisations based on the market value of the total outstanding shares issued by the same listed legal entity or a group of legal entities across all stock markets globally, where the total outstanding shares issued by the group of legal entities refer to cases where the listed entity is a parent company of a group of legal entities.
Large market cap is defined as a market capitalisation equal to or greater than USD 2 billion and small market cap is defined as a market capitalisation of less than USD 2 billion.
(https://www.bis.org/basel_framework/chapter/MAR/21.htm?inforce=20230101&published=20200327)",MRKT_CPTLSTN_INDCTR,
ECB,MSRMNT_MTHD,MSRMNT_MTHD,Measurement method,MSRMNT_MTHD,"This variable identifies the type of measurement method according to IAS (See IAS 16.30, 16.31 and IAS 40.33-55, 76).",MSRMNT_MTHD,
ECB,MSTR_AGRMNT_CCP_ASSGNMNT_TYP,MSTR_AGRMNT_CCP_ASSGNMNT_TYP,Master agreement Central counterparty assignment type,MSTR_AGRMNT_ENTTY_RL_ASSGNMNT_TYP,A discriminator to distinguish between assignment between a master agreement with qualified and with non-qualified central counterparties.,MSTR_AGRMNT_CCP_ASSGNMNT_TYP,
ECB,MSTR_AGRMNT_ENTTY_RL_ASSGNMNT_TYP,MSTR_AGRMNT_ENTTY_RL_ASSGNMNT_TYP,Master agreement Entity role type,MSTR_AGRMNT_ENTTY_RL_ASSGNMNT_TYP,"A discriminator to distinguish between different assignments between a master agreement and involved party roles, for example master agreement central counterparty assignment.",MSTR_AGRMNT_ENTTY_RL_ASSGNMNT_TYP,
ECB,MSTR_AGRMNT_ID,MSTR_AGRMNT_ID,Master agreement identifier,STRNG,An identifier to uniquely identify each master agreement.,MSTR_AGRMNT_ID,
ECB,MSTR_AGRMNT_RFRNC_DT,MSTR_AGRMNT_RFRNC_DT,Master agreement Reference date,DT,The date the data refers to.,MSTR_AGRMNT_RFRNC_DT,
ECB,MSTR_AGRMNT_RPRTNG_AGNT_ID,MSTR_AGRMNT_RPRTNG_AGNT_ID,Master agreement Reporting agent identifier,STRNG,Identifier of the reporting agent.,MSTR_AGRMNT_RPRTNG_AGNT_ID,
ECB,MSTR_AGRMNT_TYP,MSTR_AGRMNT_TYP,Master agreement type,MSTR_AGRMNT_TYP,A discriminator to distinguish between master agreements with a central counterparty and with a clearing member.,MSTR_AGRMNT_TYP,
ECB,MSTR_AGRMNT_WIT_CCP_TYP,MSTR_AGRMNT_WIT_CCP_TYP,Master agreement with central counterparty type,MSTR_AGRMNT_TYP,A discriminator to distinguish between master agreements with qualified and with non-qualified central counterparties.,MSTR_AGRMNT_WIT_CCP_TYP,
ECB,NGTBL_SCRTY_INDCTR,NGTBL_SCRTY_INDCTR,Negotiable security indicator,NGTBL_SCRTY,An indicator specifying is a security is listed or not.,NGTBL_SCRTY_INDCTR,
ECB,NGTBL_SCRTY_PSTN_INDCTR,NGTBL_SCRTY_PSTN_INDCTR,Negotiable security position indicator,SCRTY_EXCHNG_TRDBL_DRVTV_PSTN_TYP,Negotiable security position indicator distinguishes Long security positions into those that relate to Negotiable securities and those that relate to Non-negotiable securities.,NGTBL_SCRTY_PSTN_INDCTR,
ECB,NMBR_SHRS,NMBR_SHRS,Number of shares,MNTRY,The number of shares of a security.,NMBR_SHRS,
ECB,NN_DFLT_FNNCL_ASST_INSTRMNT_INDVDLLY_ASSSSD_TYP,NN_DFLT_FNNCL_ASST_INSTRMNT_INDVDLLY_ASSSSD_TYP,Non-default financial asset instrument individually assessed type,ABSTRCT_INSTRMNT_RL_TYP,"A discriminator to distinguish between performing and non-performing financial asset instruments that have been individually assessed (according to Regulation (EU) 575/2013, Article 178, subparagraph following (b)).",NN_DFLT_FNNCL_ASST_INSTRMNT_INDVDLLY_ASSSSD_TYP,
ECB,NN_FNNCL_ASST_ID,NN_FNNCL_ASST_ID,Non financial asset ID,STRNG,,NN_FNNCL_ASST_ID,
ECB,NN_FNNCL_ASST_NN_FNNCL_LBLTY_TYP,NN_FNNCL_ASST_NN_FNNCL_LBLTY_TYP,Non-financial asset and non-financial liabilty type,TYP_ACCNTNG_ITM,A discriminator to distinguish between non-financial assets and non-financial liabilities.,NN_FNNCL_ASST_NN_FNNCL_LBLTY_TYP,
ECB,NN_FNNCL_ASST_TYP,NN_FNNCL_ASST_TYP,Non-financial asset type,TYP_ACCNTNG_ITM,"A discriminator to distinguish between different types of non-financial assets. For example intangible assets, tax assets.",NN_FNNCL_ASST_TYP,
ECB,NN_FNNCL_LBLTY_ID,NN_FNNCL_LBLTY_ID,Non financial liability ID,STRNG,,NN_FNNCL_LBLTY_ID,
ECB,NN_FNNCL_LBLTY_TYP,NN_FNNCL_LBLTY_TYP,Non-financial liability type,TYP_ACCNTNG_ITM,"A discriminator to distinguish between different types of non-financial liabilities. For provisions, tax liabilities.",NN_FNNCL_LBLTY_TYP,
ECB,NN_MMBR_STT_CNTRY_CD,NN_MMBR_STT_CNTRY_CD,Non-reporting member state Country code,GGRPHCL_ARS,The country code of the non-reporting member state.,NN_MMBR_STT_CNTRY_CD,
ECB,NN_PRFRMNG_EXT_CRTR_MT_INDCTR,NN_PRFRMNG_EXT_CRTR_MT_INDCTR,Non-performing exit criteria met indicator,FLD_NN_PRFRMNG_EXT_CRTR_INDCTR,Non-performing forborne exposures that failed to meet the non-performing exit criteria.,NN_PRFRMNG_EXT_CRTR_MT_INDCTR,
ECB,NN_QCCP_ORGNSTN_PRTY_ID,NN_QCCP_ORGNSTN_PRTY_ID,Non-qualifying central counterparty Organisation Party identifier,STRNG,The party identifier of the non-qualifying central counterparty.,NN_QCCP_ORGNSTN_PRTY_ID,
ECB,NN_QCCP_ORGNSTN_PRTY_RFRNC_DT,NN_QCCP_ORGNSTN_PRTY_RFRNC_DT,Non-qualifying central counterparty Organisation Party Reference date,DT,The date the data refers to.,NN_QCCP_ORGNSTN_PRTY_RFRNC_DT,
ECB,NN_QCCP_ORGNSTN_PRTY_RPRTNG_AGNT_ID,NN_QCCP_ORGNSTN_PRTY_RPRTNG_AGNT_ID,Non-qualifying central counterparty Organisation Party Reporting agent identifier,STRNG,Identifier of the reporting agent.,NN_QCCP_ORGNSTN_PRTY_RPRTNG_AGNT_ID,
ECB,NN_QCCP_ORGNSTN_RL_TYP,NN_QCCP_ORGNSTN_RL_TYP,Non-qualifying central counterparty Organisation role type,ENTTY_RL_TYP,The non-qualitying central counterparty role.,NN_QCCP_ORGNSTN_RL_TYP,
ECB,NN_RGSTRD_CLLTRL_TYP,NN_RGSTRD_CLLTRL_TYP,Non-registered collateral type,TYP_PRTCTN,"A discriminator to distinguish between different types of non-registered collateral. Examples are machinery and equipment collateral, commodity collateral.",NN_RGSTRD_CLLTRL_TYP,
ECB,NN_RTL_EXPSR_FNNCL_ASST_INSTRMNT_TYP,NN_RTL_EXPSR_FNNCL_ASST_INSTRMNT_TYP,Non-retail exposure financial asset instrument type,ABSTRCT_INSTRMNT_RL_TYP,A discriminator to distinguish between performing and non-performing financial asset instruments that have not been classified as retail exposures.,NN_RTL_EXPSR_FNNCL_ASST_INSTRMNT_TYP,
ECB,NTRL_PRSN_TYP,NTRL_PRSN_TYP,Natural person type,PRTY_TYP,A discriminator to distinguish between self employeed and non-self employeed natural persons.,NTRL_PRSN_TYP,
ECB,OFF_BLNC_INSTRMNT_TYP,OFF_BLNC_INSTRMNT_TYP,Off-balance instrument type,TYP_INSTRMNT,A discriminator to distinguish between financial guarantees and other commitments (other than credit facilities).,OFF_BLNC_INSTRMNT_TYP,
ECB,OFFC_CMMRCL_PRMS_CLLTRL_INDCTR,OFFC_CMMRCL_PRMS_CLLTRL_INDCTR,Offices and commercial premises collateral indicator,TYP_PRTCTN,Offices and commercial premises collateral indicator distinguishes Offices and commercial premises collateral based on whether it is land or non-land related.,OFFC_CMMRCL_PRMS_CLLTRL_INDCTR,
ECB,OFFCL_SCRTY_ID,OFFCL_SCRTY_ID,Official security identifier,STRNG,Official security identifier.,OFFCL_SCRTY_ID,
ECB,OPTN_MTRTY,OPTN_MTRTY,Option maturity,RL,The option maturity to which this sensitivity relates.,OPTN_MTRTY,
ECB,ORGNL_CSH_RSRV_AMNT,ORGNL_CSH_RSRV_AMNT,Original cash reserve amount,MNTRY,The original cash reserve amount of a factoring operation.,ORGNL_CSH_RSRV_AMNT,
ECB,ORGNL_NMNL_AMNT,ORGNL_NMNL_AMNT,Original nominal amount,MNTRY,The original nominal amount. E.g. for debt securities issued it is the nominal amount at issuance date.,ORGNL_NMNL_AMNT,
ECB,ORGNSTN_PRTY_ID,ORGNSTN_PRTY_ID,Organisation Party identifier,STRNG,The party identifier of the involved organisation.,ORGNSTN_PRTY_ID,
ECB,ORGNSTN_PRTY_RFRNC_DT,ORGNSTN_PRTY_RFRNC_DT,Organisation Party Reference date,DT,The date the data refers to.,ORGNSTN_PRTY_RFRNC_DT,
ECB,ORGNSTN_PRTY_RPRTNG_AGNT_ID,ORGNSTN_PRTY_RPRTNG_AGNT_ID,Organisation Party Reporting agent identifier,STRNG,Identifier of the reporting agent.,ORGNSTN_PRTY_RPRTNG_AGNT_ID,
ECB,ORGNSTN_RL_TYP,ORGNSTN_RL_TYP,Organisation role type,ENTTY_RL_TYP,The organisation role.,ORGNSTN_RL_TYP,
ECB,ORGNSTN_TYP,ORGNSTN_TYP,Organisation type,PRTY_TYP,A discriminator to distinguish between different types of organisation.,ORGNSTN_TYP,
ECB,ORGNSTN_TYP_BY_PRCDNG_STTS,ORGNSTN_TYP_BY_PRCDNG_STTS,Organisation type by legal proceeding status,PRTY_TYP,A discriminator to distinguish between organisations where legal proceedings are ongoing and those without legal proceedings.,ORGNSTN_TYP_BY_PRCDNG_STTS,
ECB,ORGNSTNL_UNT_TYP,ORGNSTNL_UNT_TYP,Organisational unit type,PRTY_TYP,"A discriminator to distinguish between different types of organisational units, like branches or investment funds / vehicles.",ORGNSTNL_UNT_TYP,
ECB,OTC_CRDT_DFLT_SWP_INSTRMNT_ID,OTC_CRDT_DFLT_SWP_INSTRMNT_ID,Over the counter (OTC) Credit default swap Instrument identifier,STRNG,An identifier applied by the reporting agent to uniquely identify each instrument under a single contract. Each instrument must have one instrument identifier. This value will not change over time and cannot be used as the instrument identifier for any other instrument under the same contract.,OTC_CRDT_DFLT_SWP_INSTRMNT_ID,
ECB,OTC_CRDT_DFLT_SWP_INSTRMNT_RFRNC_DT,OTC_CRDT_DFLT_SWP_INSTRMNT_RFRNC_DT,Over the counter (OTC) Credit default swap Instrument Reference date,DT,The date the data refers to.,OTC_CRDT_DFLT_SWP_INSTRMNT_RFRNC_DT,
ECB,OTC_CRDT_DFLT_SWP_INSTRMNT_RL_TYP,OTC_CRDT_DFLT_SWP_INSTRMNT_RL_TYP,Over the counter (OTC) Credit default swap Instrument role type,ABSTRCT_INSTRMNT_RL_TYP,"A discriminator to distinguish between different roles an instrument may act in. Examples are financial asset instrument, financial liability instrument.",OTC_CRDT_DFLT_SWP_INSTRMNT_RL_TYP,
